S.No,Headline,Source,Link,Category
201,"FBI ex-chief James Comey criminally charged as Trump targets critics, source says",Hindu,https://www.thehindu.com/news/international/fbi-ex-chief-james-comey-criminally-charged-as-trump-targets-critics-source-says/article70095337.ece,International
202,"Russia accuses NATO, EU of waging 'real war' on it via Ukraine",Hindu,https://www.thehindu.com/news/international/russia-accuses-nato-eu-of-waging-real-war-on-it-via-ukraine/article70095332.ece,International
203,Trump says he will not allow Israel to annex the West Bank,Hindu,https://www.thehindu.com/news/international/trump-says-he-will-not-allow-israel-to-annex-the-west-bank/article70095178.ece,International
204,IAEA says drone detonated near Ukraine's South Ukraine nuclear plant,Hindu,https://www.thehindu.com/news/international/iaea-says-drone-detonated-near-ukraines-south-ukraine-nuclear-plant/article70095163.ece,International
205,Trump signs order declaring TikTok sale plan meets U.S. requirements,Hindu,https://www.thehindu.com/news/international/trump-signs-order-declaring-tiktok-sale-plan-meets-us-requirements/article70095159.ece,International
206,Officials say 911 emergency lines down across Mississippi and Louisiana,Hindu,https://www.thehindu.com/news/international/officials-say-911-emergency-lines-down-across-mississippi-and-louisiana/article70095146.ece,International
207,Chinese Premier says U.S. and his country need to 'work in same direction',Hindu,https://www.thehindu.com/news/international/chinese-premier-says-us-and-his-country-need-to-work-in-same-direction/article70095125.ece,International
208,India hosting Hasina creates tension in India-Bangladesh relations: Prof. Yunus,Hindu,https://www.thehindu.com/news/international/india-hosting-hasina-creates-tension-in-india-bangladesh-relations-prof-yunus/article70094654.ece,International
209,White House budget office tells agencies to draft mass firing plans ahead of potential shutdown,Hindu,https://www.thehindu.com/news/international/white-house-budget-office-tells-agencies-to-draft-mass-firing-plans-ahead-of-potential-shutdown/article70093806.ece,International
210,Hegseth abruptly summons top military commanders to meeting in Virginia next week,Hindu,https://www.thehindu.com/news/international/hegseth-abruptly-summons-top-military-commanders-to-meeting-in-virginia-next-week/article70094975.ece,International
211,Religious extremists attacked houses and shops of Ahmadis over burial of woman in Pakistan,Hindu,https://www.thehindu.com/news/international/religious-extremists-attacked-houses-and-shops-of-ahmadis-over-burial-of-woman-in-pakistan/article70093858.ece,International
212,Ecuador prison riot leaves at least 17 dead,Hindu,https://www.thehindu.com/news/international/several-killed-in-ecuador-prison-riot-updates/article70094950.ece,International
213,"India, Russia discuss BRICS grain exchange plan to boost agriculture trade ties",Hindu,https://www.thehindu.com/news/national/india-russia-discuss-creation-of-brics-grain-exchange/article70094725.ece,International
214,Microsoft disables services to Israel defence unit after review,Hindu,https://www.thehindu.com/sci-tech/technology/microsoft-disables-services-to-israel-defence-unit-after-review/article70094906.ece,International
215,"After violent protests, Nepal faces an uneasy road to a democratic future",Hindu,https://www.thehindu.com/news/international/after-violent-protests-nepal-faces-an-uneasy-road-to-a-democratic-future/article70094588.ece,International
216,UN expert flags Sri Lankans being trafficked to fight Russia’s war in Ukraine,Hindu,https://www.thehindu.com/news/international/un-expert-flags-sri-lankans-being-trafficked-to-fight-russias-war-in-ukraine/article70093823.ece,International
217,"Hamas will have no role in governing postwar Gaza, says Palestinian President at UNGA",Hindu,https://www.thehindu.com/news/international/hamas-will-have-no-role-in-governing-postwar-gaza-says-palestinian-president-at-unga/article70094016.ece,International
218,"Russian warplanes detected flying near Alaska for ninth time this year, U.S. military says",Hindu,https://www.thehindu.com/news/international/russian-warplanes-detected-flying-near-alaska-for-ninth-time-this-year-us-military-says/article70093722.ece,International
219,Houthi media report Israeli strikes on Sanaa,Hindu,https://www.thehindu.com/news/international/israel-attack-on-sanaa-yemen-houthis-september-25-2025/article70093780.ece,International
220,Former French President Sarkozy handed five-year jail term in Libya graft trial,Hindu,https://www.thehindu.com/news/international/former-french-president-sarkozy-handed-five-year-jail-term-in-libya-graft-trial/article70093250.ece,International
221,"Kamala Harris faces protesters, condemns Israel's war in Gaza on first night of book tour",Hindu,https://www.thehindu.com/news/international/kamala-harris-faces-protesters-condemns-israels-war-in-gaza-on-first-night-of-book-tour/article70092733.ece,International
222,"Pakistan PM Sharif holds meeting with Bangladesh's Yunus, Sri Lanka's Dissanayake in New York",Hindu,https://www.thehindu.com/news/international/pakistan-pm-sharif-holds-meeting-with-bangladeshs-yunus-sri-lankas-dissanayake-in-new-york/article70093051.ece,International
223,"Russia says it assumes Trump, despite shift in tone, is still committed to seek peace in Ukraine",Hindu,https://www.thehindu.com/news/international/russia-says-it-assumes-trump-despite-shift-in-tone-is-still-committed-to-seek-peace-in-ukraine/article70092934.ece,International
224,"‘Will speak our truth’: Ahead of UNGA address, Israeli PM Netanyahu slams leaders recognising Palestinian state",Hindu,https://www.thehindu.com/news/international/israel-palestine-state-netanyahu-us-unga-world/article70092604.ece,International
225,Daily Quiz | On the peculiarities of journalism,Hindu,https://www.thehindu.com/news/international/daily-quiz-on-the-peculiarities-of-journalism-on-occasion-of-columbia-journalism-school-anniversary/article70092484.ece,International
226,Watch: Israel does not have the right to prevent creation of Palestine State: Meloni,Hindu,https://www.thehindu.com/shorts/watch-israel-does-not-have-the-right-to-prevent-creation-of-palestine-state-meloni/article70093093.ece,International
227,Watch | Ready to deploy 20000 troops for peace in Gaza and elsewhere: Indonesian Prez at the UN,Hindu,https://www.thehindu.com/shorts/watch-ready-to-deploy-20000-troops-for-peace-in-gaza-and-elsewhere-indonesian-prez-at-the-un/article70092744.ece,International
228,Bangladesh’s student-led NCP threatens to halt elections after EC’s refusal to grant demanded symbol,Hindu,https://www.thehindu.com/news/international/bangladeshs-student-led-ncp-threatens-to-halt-elections-after-ecs-refusal-to-grant-demanded-symbol/article70090609.ece,International
229,Statue of Trump and Epstein removed from Washington's National Mall,Hindu,https://www.thehindu.com/news/international/statue-of-trump-and-epstein-removed-from-washingtons-national-mall/article70092521.ece,International
230,Syrian President Ahmad al-Sharaa makes first United Nations address in nearly 60 years,Hindu,https://www.thehindu.com/news/international/syrian-president-ahmad-al-sharaa-makes-first-united-nations-address-in-nearly-60-years/article70092355.ece,International
231,South Korea says the North has 4 uranium enrichment facilities to build nuclear weapons,Hindu,https://www.thehindu.com/news/international/south-korea-says-the-north-has-4-uranium-enrichment-facilities-to-build-nuclear-weapons/article70092329.ece,International
232,Drones spotted near 4 Danish airports but authorities say no threat to public,Hindu,https://www.thehindu.com/news/international/drones-spotted-near-4-danish-airports-denmark-government-news-conference/article70092315.ece,International
233,"Watch: Super Typhoon Ragasa batters Philippines, rescue operations underway",Hindu,https://www.thehindu.com/shorts/watch-super-typhoon-ragasa-batters-philippines-rescue-operations-underway/article70092254.ece,International
234,"China, world's largest carbon polluting nation, announces new climate goal to cut emissions",Hindu,https://www.thehindu.com/news/international/china-worlds-largest-carbon-polluting-nation-announces-new-climate-goal-to-cut-emissions/article70092039.ece,International
235,Indian among 7 Buddhist monks killed in Sri Lanka monastery cable cart accident,Hindu,https://www.thehindu.com/news/international/sri-lanka-buddhist-monastery-indian-killed-monks-cable-cart-accident/article70092009.ece,International
236,"Two Indians sanctioned by U.S. for trafficking fentanyl, other illicit drugs",Hindu,https://www.thehindu.com/news/national/two-indians-sanctioned-by-us-for-trafficking-fentanyl-other-illicit-drugs/article70092019.ece,International
237,"Watch: William Ruto questions UN’s relevance at 80, calls for urgent reforms",Hindu,https://www.thehindu.com/shorts/watch-william-ruto-questions-uns-relevance-at-80-calls-for-urgent-reforms/article70092014.ece,International
238,Hong Kong reopens after world's most powerful Typhoon Ragasa,Hindu,https://www.thehindu.com/news/international/hong-kong-reopens-after-worlds-most-powerful-typhoon-ragasa/article70091815.ece,International
239,"‘Very excited about India’ as U.S. presses farm trade, says Brooke Rollins",Hindu,https://www.thehindu.com/news/international/very-excited-about-india-as-us-presses-farm-trade-says-brooke-rollins/article70091801.ece,International
240,"Russia wants to expand war against Ukraine, Zelenskyy warns at UN",Hindu,https://www.thehindu.com/news/international/russia-wants-to-expand-war-against-ukraine-zelenskyy-warns-at-un/article70091705.ece,International
241,New $100k H1B visa fee could threaten Indian students’ American dream,Hindu,https://www.thehindu.com/data/the-new-100k-visa-fee-could-threaten-indian-students-american-dream/article70090340.ece,International
242,"Ukraine restores diplomatic ties with Syria, says Zelenskyy",Hindu,https://www.thehindu.com/news/international/ukraine-restores-diplomatic-ties-with-syria-says-zelenskyy/article70090904.ece,International
243,6.2-magnitude earthquake hits northwest Venezuela,Hindu,https://www.thehindu.com/news/international/61-magnitude-earthquake-hits-northwest-venezuela/article70090905.ece,International
244,Trump says he was victim of ‘triple sabotage’ at UN and Secret Service is looking into the matter,Hindu,https://www.thehindu.com/news/international/trump-says-he-was-victim-of-triple-sabotage-at-un-and-secret-service-is-looking-into-the-matter/article70090903.ece,International
245,"Israel says conclusion of talks with Syria contingent on demilitarisation, safeguarding Druze",Hindu,https://www.thehindu.com/news/international/israel-says-conclusion-of-talks-with-syria-contingent-on-demilitarisation-safeguarding-druze/article70090891.ece,International
246,Former President Mutharika wins Malawi election to oust longtime rival Chakwera,Hindu,https://www.thehindu.com/news/international/former-president-mutharika-wins-malawi-election-to-oust-longtime-rival-chakwera/article70090740.ece,International
247,Typhoon Ragasa slams into south China after killing 14 in Taiwan,Hindu,https://www.thehindu.com/news/international/typhoon-ragasa-slams-into-south-china-after-killing-14-in-taiwan/article70090738.ece,International
248,Strike on market in Sudan's El-Fasher kills 15 people,Hindu,https://www.thehindu.com/news/international/strike-on-market-in-sudans-el-fasher-kills-15-people/article70089709.ece,International
249,"1 detainee killed and 2 others critically injured in Dallas ICE facility, Homeland Security says",Hindu,https://www.thehindu.com/news/international/1-detainee-killed-and-2-others-critically-injured-in-dallas-ice-facility-homeland-security-says/article70090733.ece,International
250,"UNGA 80: Jaishankar holds bilateral talks with counterparts from Mexico, Cyprus, Pacific nations",Hindu,https://www.thehindu.com/news/national/eam-jaishankar-hosts-fipic-foreign-ministers-meeting-in-new-york/article70090730.ece,International
251,"Trump 'incredibly impatient' with Russia on Ukraine, Vance says",Hindu,https://www.thehindu.com/news/international/trump-incredibly-impatient-with-russia-on-ukraine-vance-says/article70090709.ece,International
252,U.S. envoy Witkoff confident of 'some sort of breakthrough' on Gaza in coming days,Hindu,https://www.thehindu.com/news/international/us-envoy-witkoff-confident-of-some-sort-of-breakthrough-on-gaza-in-coming-days/article70090696.ece,International
253,Israeli forces kill 15 Palestinians: Gaza civil defence,Hindu,https://www.thehindu.com/news/international/israeli-forces-kill-15-palestinians-gaza-civil-defence/article70089616.ece,International
254,Watch: 3 people shot at Dallas ICE facility; shooter dead,Hindu,https://www.thehindu.com/shorts/watch-3-people-shot-at-dallas-ice-facility-shooter-dead/article70090539.ece,International
255,Man arrested in U.K. over alleged cyberattack that affected European airports,Hindu,https://www.thehindu.com/news/international/man-arrested-in-uk-over-alleged-cyberattack-that-affected-european-airports/article70090516.ece,International
256,Watch: ‘Trump’s patience isn’t infinite!’: Rubio warns Russia,Hindu,https://www.thehindu.com/shorts/watch-trumps-patience-isnt-infinite-rubio-warns-russia/article70089320.ece,International
257,3 people shot at Dallas ICE facility; shooter dead,Hindu,https://www.thehindu.com/news/international/three-injured-in-shooting-at-ice-facility-in-dallas-local-media-reports/article70089189.ece,International
258,Watch: U.S. overhauls H1B visa system: who will really benefit?,Hindu,https://www.thehindu.com/videos/watch-us-overhauls-h1b-visa-system-who-will-really-benefit/article70089034.ece,International
259,Pakistan PM Shehbaz to travel to Washington to meet President Trump on September 25,Hindu,https://www.thehindu.com/news/international/pakistan-pm-shehbaz-to-travel-to-washington-to-meet-president-trump-on-september-25/article70088705.ece,International
260,"Kremlin says Trump claims on war in Ukraine are mistaken, offers ‘real information’",Hindu,https://www.thehindu.com/news/international/us-washing-hands-of-matter-nationalists-mock-trump-u-turn-as-kremlin-rejects-trump-claims-on-russia-ukraine-war/article70088259.ece,International
261,Massive sinkhole in Bangkok street forces evacuations,Hindu,https://www.thehindu.com/news/international/massive-sinkhole-in-bangkok-street-forces-evacuations/article70088494.ece,International
262,"After mechanical challenges, U.N. says Trump’s team to blame for nonworking escalator, teleprompter",Hindu,https://www.thehindu.com/news/international/after-mechanical-challenges-un-says-trumps-team-to-blame-for-nonworking-escalator-teleprompter/article70088448.ece,International
263,"U.S., E.U. trading with Moscow too: China dismisses Trump’s ‘primary funder’ of Ukraine war criticism over Russian oil purchases",Hindu,https://www.thehindu.com/news/international/china-us-eu-india-trump-russia-ukraine-war-oil-trade-funding-trade/article70088291.ece,International
264,How a SIM farm like the one found near the UN threatens telecom networks,Hindu,https://www.thehindu.com/sci-tech/technology/how-a-sim-farm-like-the-one-found-near-the-un-threatens-telecom-networks/article70088064.ece,International
265,"‘India is mostly with us’, says Zelenskyy",Hindu,https://www.thehindu.com/news/international/india-mostly-with-us-says-ukrainian-president-zelenskyy/article70088115.ece,International
266,Typhoon Ragasa: Hong Kong’s airlines evacuate planes as they wait out year’s strongest storm,Hindu,https://www.thehindu.com/news/international/super-typhoon-ragasa-hong-kong-china-taiwan-casualties-landflall-storm-cyclone/article70088049.ece,International
267,"Watch: Typhoon Ragasa: Lake burst Kills 14, 124 missing in Taiwan",Hindu,https://www.thehindu.com/shorts/watch-typhoon-ragasa-lake-burst-kills-14-124-missing-in-taiwan/article70088018.ece,International
268,First U.S. Artemis astronaut mission around the moon on track for April,Hindu,https://www.thehindu.com/sci-tech/science/first-us-artemis-astronaut-mission-around-the-moon-on-track-for-april/article70087500.ece,International
269,H-1B visa | The Hindu’s coverage on U.S. work immigration visa fee hike and its impact,Hindu,https://www.thehindu.com/news/international/h-1b-visa-the-hindus-coverage-on-us-work-immigration-visa-fee-hike-and-its-impact/article70087483.ece,International
270,"Global South must work together, says Jaishankar",Hindu,https://www.thehindu.com/news/national/external-affairs-minister-jaishankar-calls-for-stronger-global-south-solidarity-collective-push-for-united-nations-reform/article70087554.ece,International
271,Palestine state recognition ‘when not if’: Japan PM Shigeru Ishiba,Hindu,https://www.thehindu.com/news/international/palestine-state-recognition-unga-japan-pm-global-reactions/article70087480.ece,International
272,Activists say Gaza aid flotilla attacked by ‘multiple drone’,Hindu,https://www.thehindu.com/news/international/activists-say-gaza-aid-flotilla-attacked-by-multiple-drone/article70087450.ece,International
273,Macron says Trump should stop Gaza war if he wants Nobel peace prize,Hindu,https://www.thehindu.com/news/international/macron-says-trump-should-stop-gaza-war-if-he-wants-nobel-peace-prize/article70087355.ece,International
274,"14 killed, 124 missing in Taiwan after barrier lake burst",Hindu,https://www.thehindu.com/news/international/casualities-in-taiwan-super-typhoon-ragasa-barrier-lake-burst/article70087316.ece,International
275,The mapping of the India-China border,Hindu,https://www.thehindu.com/news/international/the-mapping-of-the-india-china-border/article70086074.ece,International
276,Turkiye’s Erdogan again refers to Kashmir issue in UNGA address,Hindu,https://www.thehindu.com/news/international/turkeys-erdogan-again-refers-to-kashmir-issue-in-unga-address/article70087235.ece,International
277,New H-1B visa process with wage tiers proposed to replace lottery system,Hindu,https://www.thehindu.com/news/international/us-h-1b-visa-process-high-skilled-workers-trump-administration-lottery-system/article70087225.ece,International
278,United Nations Security Council meeting on Gaza highlights growing isolation of U.S. on West Asia conflict,Hindu,https://www.thehindu.com/news/international/united-nations-security-council-meeting-on-gaza-highlights-growing-isolation-of-us-on-mideast-conflict/article70087221.ece,International
279,Super Typhoon lashes Hong Kong with hurricane-force winds and heavy rain,Hindu,https://www.thehindu.com/news/international/super-typhoon-lashes-hong-kong-with-hurricane-force-winds-and-heavy-rain/article70086518.ece,International
280,France's Macron warns against 'survival of the fittest' in world affairs,Hindu,https://www.thehindu.com/news/international/frances-macron-warns-against-survival-of-the-fittest-in-world-affairs/article70086522.ece,International
281,Rupee rises 4 paise to close at 88.72 against U.S. dollar,Hindu,https://www.thehindu.com/business/markets/rupee-rises-4-paise-to-close-at-8872-against-us-dollar/article70097461.ece,Business
282,Supreme Court defers Vodafone Idea plea against extra AGR demand to October 6,Hindu,https://www.thehindu.com/news/national/supreme-court-defers-vodafone-idea-plea-against-extra-agr-demand-to-october-6/article70097233.ece,Business
283,"Government says India held ‘constructive’ meetings in the U.S., does not reveal date of next official meeting",Hindu,https://www.thehindu.com/business/Economy/india-held-constructive-meetings-in-us-does-not-reveal-date-of-next-official-negotiation-round-government/article70097198.ece,Business
284,India’s compute consumption still remains low; with students having only a tiny access to computers,Hindu,https://www.thehindu.com/business/Industry/indias-compute-consumption-still-remains-low-with-students-having-only-a-tiny-access-to-computers/article70094174.ece,Business
285,Turkish Airlines to expand fleet with 225 new Boeing aircraft after Tayyip Erdogan's U.S. visit,Hindu,https://www.thehindu.com/news/international/turkish-airlines-to-expand-fleet-with-225-new-boeing-aircraft-after-tayyip-erdogans-us-visit/article70096965.ece,Business
286,"Somerville College, University of Oxford, honours Tata Sons chairman Natarajan Chandrasekaran with Foundation Fellowship",Hindu,https://www.thehindu.com/business/somerville-college-university-of-oxford-honours-tata-sons-chairman-natarajan-chandrasekaran-with-foundation-fellowship/article70094528.ece,Business
287,Immediate impact on Indian pharma exports unlikely: Pharmexcil chairman Namit Joshi,Hindu,https://www.thehindu.com/business/Industry/immediate-impact-on-indian-pharma-exports-unlikely-pharmexcil-chairman-namit-joshi/article70096708.ece,Business
288,U.S. plans 1:1 chip production rule to curb overseas reliance: Report,Hindu,https://www.thehindu.com/sci-tech/technology/us-plans-11-chip-production-rule-to-curb-overseas-reliance-report/article70096705.ece,Business
289,Supreme Court upholds NCLAT approval of JSW’s resolution plan for Bhushan Power and Steel Limited,Hindu,https://www.thehindu.com/business/Industry/supreme-court-bhushan-power-and-steel-limited-insolvency-acquisition-jsw-verdict-sept-26-2025/article70096698.ece,Business
290,"CoreWeave expands OpenAI pact with new $6.5 billion contract, sees ""the quarter of diversification""",Hindu,https://www.thehindu.com/sci-tech/technology/coreweave-expands-openai-pact-with-new-65-billion-contract-sees-the-quarter-of-diversification/article70096276.ece,Business
291,"Rupee recovers from all-time low, rises 6 paise to 88.70 against U.S. dollar",Hindu,https://www.thehindu.com/business/markets/rupee-recovers-from-all-time-low-rises-6-paise-to-8870-against-us-dollar/article70096441.ece,Business
292,Elon Musk's xAI to provide Grok chatbot to U.S. federal agencies,Hindu,https://www.thehindu.com/sci-tech/technology/elon-musks-xai-to-provide-grok-chatbot-to-us-federal-agencies/article70096281.ece,Business
293,"Equity markets trade lower dragged by pharma stocks, relentless foreign fund outflows",Hindu,https://www.thehindu.com/business/markets/equity-markets-trade-lower-dragged-by-pharma-stocks-relentless-foreign-fund-outflows/article70096444.ece,Business
294,U.S. judge preliminarily approves $1.5 billion Anthropic copyright settlement,Hindu,https://www.thehindu.com/sci-tech/technology/us-judge-preliminarily-approves-15-billion-anthropic-copyright-settlement/article70096260.ece,Business
295,"Doubling capacity at Mumbai terminal boosts efficiency, faster vessel turnaround, says PSA India",Hindu,https://www.thehindu.com/business/doubling-capacity-at-mumbai-terminal-boosts-efficiency-faster-vessel-turnaround-says-psa-india/article70094802.ece,Business
296,Amazon to pay $2.5 billion to settle Prime deception allegations,Hindu,https://www.thehindu.com/sci-tech/technology/amazon-to-pay-25-billion-to-settle-prime-deception-allegations/article70096270.ece,Business
297,Škoda to introduce next generation Octavia RS in India,Hindu,https://www.thehindu.com/business/%C5%A1koda-to-introduce-next-generation-octavia-rs-in-india/article70093177.ece,Business
298,Natco Pharma mulls demerger of agro business,Hindu,https://www.thehindu.com/business/natco-pharma-mulls-demerger-of-agro-business/article70094763.ece,Business
299,"Coca-Cola bottlers to invest ₹25,760 crore in India's food processing sector",Hindu,https://www.thehindu.com/business/coca-cola-bottlers-to-invest-25760-crore-in-indias-food-processing-sector/article70094821.ece,Business
300,"Standard Chartered, CCIL and IFSCA to open dollar clearing facility on October 7",Hindu,https://www.thehindu.com/business/standard-chartered-ccil-and-ifsca-to-open-dollar-clearing-facility-on-october-7/article70093833.ece,Business
301,TVS Motor to buy Italian automotive design firm Engines Engineering,Hindu,https://www.thehindu.com/business/tvs-motor-to-buy-italian-automotive-design-firm-engines-engineering/article70094079.ece,Business
302,Outward remittances under LRS dips 11% in July to $2452.93 million,Hindu,https://www.thehindu.com/business/outward-remittances-under-lrs-dips-11-in-july-to-245293-million/article70094648.ece,Business
303,Late Cyrus Mistry son Firoz joins Afcons Board,Hindu,https://www.thehindu.com/business/late-cyrus-mistry-son-firoz-joins-afcons-board/article70093105.ece,Business
304,Elitecon International to raise ₹300 crore by QIP,Hindu,https://www.thehindu.com/business/elitecon-international-to-raise-300-crore-by-qip/article70092986.ece,Business
305,"Nuvama, C&W-backed fund buys office campus in Chennai from Keppel for ₹2,550 crore",Hindu,https://www.thehindu.com/business/nuvama-cw-backed-fund-buys-office-campus-in-chennai-from-keppel-for-2550-crore/article70094828.ece,Business
306,"Industry sought extension of subsidies for e-2 wheelers, but unlikely: Kinetic Green’s Motwani",Hindu,https://www.thehindu.com/business/industry-sought-extension-of-subsidies-for-e-2-wheelers-but-unlikely-kinetic-greens-motwani/article70093196.ece,Business
307,"Spanish data centre firm Submer opens shop in India, plans manufacturing",Hindu,https://www.thehindu.com/business/Industry/spanish-data-centre-firm-submer-opens-shop-in-india-plans-manufacturing/article70093551.ece,Business
308,Income Tax department extends deadline for tax audit report submission to October 31,Hindu,https://www.thehindu.com/business/Economy/income-tax-department-extends-deadline-for-tax-audit-report-submission-to-october-31/article70093386.ece,Business
309,RBI mandates tougher authentication process for digital transactions,Hindu,https://www.thehindu.com/business/Economy/rbi-mandates-tougher-authentication-process-for-digital-transactions/article70092908.ece,Business
