S.No,Headline,Source,Link,Category
1,"'Careless, speculative': MEA says PM Modi didn't call Putin after US tariff move; pans Nato chief's remarks",TOI,https://timesofindia.indiatimes.com/india/careless-speculative-mea-says-pm-modi-didnt-call-putin-pans-nato-chiefs-remarks/articleshow/124156379.cms,India
2,"'One India': Canada gets clear message from Delhi; Khalistan threat, extraditions in focus",TOI,https://timesofindia.indiatimes.com/india/one-india-canada-gets-clear-message-from-delhi-khalistan-threat-extraditions-in-focus/articleshow/124155939.cms,India
3,Sonam Wangchuk arrested: Action comes after violent protest in Ladakh,TOI,https://timesofindia.indiatimes.com/india/sonam-wangchuk-arrested-action-comes-after-violent-protest-in-ladakh-nsa/articleshow/124155582.cms,India
4,"'Not for Maharashtra': Shrikant Shinde slams MNS, UBT alliance; says tie-up is 'family politics'",TOI,https://timesofindia.indiatimes.com/india/not-for-maharashtra-shrikant-shinde-slams-mns-ubt-alliance-says-tie-up-is-family-politics/articleshow/124155394.cms,India
5,"'Paper chor': Rahul Gandhi's new attack on BJP after 'vote chori' charge; points to exam leaks, unemployment",TOI,https://timesofindia.indiatimes.com/india/paper-chor-rahul-gandhis-new-attack-on-bjp-after-vote-chori-charge-points-to-exam-leaks-unemployment/articleshow/124154890.cms,India
6,No relief for Rahul: HC junks plea in Sikh row; Varanasi court to hear case,TOI,https://timesofindia.indiatimes.com/india/no-relief-for-rahul-hc-junks-plea-in-sikh-row-varanasi-court-to-hear-case/articleshow/124153639.cms,India
7,'Fake' encounter case: SC stops cremation of Maoist leader Katha Ramchandra Reddy; directs body to be preserved,TOI,https://timesofindia.indiatimes.com/india/fake-encounter-case-sc-stops-cremation-of-maoist-leader-katha-ramchandra-reddy-directs-body-to-be-preserved/articleshow/124152284.cms,India
8,"Arvind Kejriwal condemns accusations against Sonam Wangchuk, says country's progress harassed by 'entire machinery' of Central govt",TOI,https://timesofindia.indiatimes.com/india/arvind-kejriwal-condemns-accusations-against-sonam-wangchuk-says-countrys-progress-harassed-by-entire-machinery-of-central-govt/articleshow/124152004.cms,India
9,"Poll blitz: PM Modi sends Rs 10,000 to 75 lakh women in Bihar; all you need to know about the scheme",TOI,https://timesofindia.indiatimes.com/india/poll-blitz-pm-modi-sends-rs-10k-to-75-lakh-women-in-bihar-all-you-need-to-know-about-the-scheme/articleshow/124151719.cms,India
10,Anti-Hindi showdown in Bengaluru: Protesters storm MHA promotional event attended by 6 MPs; over 40 held,TOI,https://timesofindia.indiatimes.com/india/anti-hindi-showdown-in-bengaluru-protesters-storm-mha-promotional-event-attended-by-6-mps-over-40-held/articleshow/124150517.cms,India
11,'Delhi now on phone with Moscow': Nato chief claims PM asked Putin to explain strategy on Ukraine; big claim on tariff impact,TOI,https://timesofindia.indiatimes.com/india/delhi-now-on-phone-with-moscow-nato-chief-claims-pm-asked-putin-to-explain-strategy-on-ukraine-big-claim-on-tariff-impact/articleshow/124148311.cms,India
12,"A sentinel of the skies: After 62 years in service, IAF bids farewell to MiG-21; iconic fighter jet takes final bow",TOI,https://timesofindia.indiatimes.com/india/a-sentinel-of-the-skies-after-62-years-in-service-iaf-bids-farewell-to-mig-21-iconic-fighter-jet-takes-final-bow/articleshow/124141813.cms,India
13,Manmohan Singh’s 93rd birth anniversary: PM Modi pays tribute; recalls his contributions to nation,TOI,https://timesofindia.indiatimes.com/india/manmohan-singhs-93rd-birth-anniversary-pm-modi-pays-tribute-recalls-his-contributions-to-nation/articleshow/124146601.cms,India
14,'Ba***ds of Bollywood' row: Aryan Khan and Sameer Wankhede now locked in defamation battle — case explained in 5 points,TOI,https://timesofindia.indiatimes.com/india/bads-of-bollywood-row-aryan-khan-and-sameer-wankhede-now-locked-in-defamation-battle-case-explained-in-5-points/articleshow/124140552.cms,India
15,"In NY, Jaishankar calls for peace, ending conflicts",TOI,https://timesofindia.indiatimes.com/india/in-ny-jaishankar-calls-for-peace-ending-conflicts/articleshow/124138966.cms,India
16,Entire Sunjay assets suit can't be in sealed cover: HC,TOI,https://timesofindia.indiatimes.com/india/entire-sunjay-assets-suit-cant-be-in-sealed-cover-hc/articleshow/124138930.cms,India
17,India's forest cover expanded by mere 2.5% in 10 yrs but 'very dense' cover grew 22.7%,TOI,https://timesofindia.indiatimes.com/india/indias-forest-cover-expanded-by-mere-2-5-in-10-yrs-but-very-dense-cover-grew-22-7/articleshow/124138513.cms,India
18,"Ensure day-to-day trials in criminal cases, SC tells HCs",TOI,https://timesofindia.indiatimes.com/india/ensure-day-to-day-trials-in-criminal-cases-sc-tells-hcs/articleshow/124138458.cms,India
19,"On 80-yr-old's plea, SC orders eviction of his 61-yr-old son",TOI,https://timesofindia.indiatimes.com/india/on-80-yr-olds-plea-sc-orders-eviction-of-his-61-yr-old-son/articleshow/124138246.cms,India
20,"School dropout rates halved in 2 years, says govt report",TOI,https://timesofindia.indiatimes.com/india/school-dropout-rates-halved-in-2-years-says-govt-report/articleshow/124138112.cms,India
21,“They didn’t want a Black character”: Dwyane Wade's wife Gabrielle Union opens up about being rejected from a movie due to her ethnicity,TOI,https://timesofindia.indiatimes.com/sports/nba/top-stories/they-didnt-want-a-black-character-dwyane-wades-wife-gabrielle-union-opens-up-about-being-rejected-from-a-movie-due-to-her-ethnicity/articleshow/124095651.cms,World
22,Trump's TikTok deal: Oracle and Silver Lake to lead US takeover of TikTok; all you need to know,TOI,https://timesofindia.indiatimes.com/world/us/trumps-tiktok-deal-oracle-and-silver-lake-to-lead-us-takeover-of-tiktok-all-you-need-to-know/articleshow/124153725.cms,World
23,Ukrainian YouTuber arrested in Japan over Fukushima livestream,TOI,https://timesofindia.indiatimes.com/world/rest-of-world/ukrainian-youtuber-arrested-in-japan-over-fukushima-livestream/articleshow/124153132.cms,World
24,"Top 10 US billionaires leading charity and philanthropy efforts in 2025: Warrant Buffet, Bill Gates, Mark Zuckerberg and others",TOI,https://timesofindia.indiatimes.com/world/us/top-10-us-billionaires-leading-charity-and-philanthropy-efforts-in-2025-warrant-buffet-bill-gates-mark-zuckerberg-and-others/articleshow/124152613.cms,World
25,"Productive Families in UAE to get full employment benefits including salaries, insurance, and pension",TOI,https://timesofindia.indiatimes.com/world/middle-east/productive-families-in-uae-to-get-full-employment-benefits-including-salaries-insurance-and-pension/articleshow/124149733.cms,World
26,UAE bans AI generated images of national figures and symbols without official approval,TOI,https://timesofindia.indiatimes.com/world/middle-east/uae-bans-ai-generated-images-of-national-figures-and-symbols-without-official-approval/articleshow/124152113.cms,World
27,Dhanteras 2025 Shubh Muhurat: When is the most auspicious time to buy Gold in UAE?,TOI,https://timesofindia.indiatimes.com/world/middle-east/dhanteras-2025-shubh-muhurat-when-is-the-most-auspicious-time-to-buy-gold-in-uae/articleshow/124150623.cms,World
28,"Who is ‘La Diabla’? Woman harvest organs from pregnant women and sell newborns to US couples for $14,000 each",TOI,https://timesofindia.indiatimes.com/world/us/who-is-la-diabla-woman-harvest-organs-from-pregnant-women-and-sell-newborns-to-us-couples-for-14000-each/articleshow/124152009.cms,World
29,Cheating scandal fallout: Mikie Sherrill blocked from Naval Academy ceremony,TOI,https://timesofindia.indiatimes.com/world/us/cheating-scandal-fallout-democratic-hopeful-mikie-sherrill-blocked-from-naval-academy-ceremony-records-leak-sparks-outrage/articleshow/124149635.cms,World
30,'Averted catastrophe': Pakistan PM hails Trump as ‘man of peace; all that unfolded in their meeting,TOI,https://timesofindia.indiatimes.com/world/pakistan/averted-catastrophe-pakistan-pm-hails-trump-as-man-of-peace-all-that-unfolded-in-their-meeting/articleshow/124147622.cms,World
31,"Donald Trump takes dig at Ilhan Omar: 'I asked Somali president to take her back, he refused'",TOI,https://timesofindia.indiatimes.com/world/us/donald-trump-takes-dig-at-ilhan-omar-i-asked-somali-president-to-take-her-back-he-refused/articleshow/124148757.cms,World
32,UAE: Sharjah extradites Uzbek and Nepalese nationals wanted for fraud under Interpol Red Notices,TOI,https://timesofindia.indiatimes.com/world/middle-east/uae-sharjah-extradites-uzbek-and-nepalese-nationals-wanted-for-fraud-under-interpol-red-notices/articleshow/124145216.cms,World
33,Canadian shot in Wisconsin: Tourist Giovanni Michael killed on golf trip while walking to hotel,TOI,https://timesofindia.indiatimes.com/world/us/canadian-shot-in-wisconsin-tourist-giovanni-michael-mike-robinson-killed-on-golf-trip-while-walking-to-hotel-hunt-on-for-suv-driver/articleshow/124146588.cms,World
34,"'Maybe somewhere in Oval Office': Did Trump keep Pakistan PM, army chief waiting - watch what he said",TOI,https://timesofindia.indiatimes.com/world/us/maybe-somewhere-in-oval-office-did-trump-keep-pakistan-pm-army-chief-waiting-watch-what-he-said/articleshow/124144481.cms,World
35,Another tropical storm causes 4 deaths and new evacuations in Philippines,TOI,https://timesofindia.indiatimes.com/world/rest-of-world/another-tropical-storm-causes-4-deaths-and-new-evacuations-in-philippines/articleshow/124145281.cms,World
36,"Obsessed with weed: Anti-ICE shooter hated US govt, targeted federal agents",TOI,https://timesofindia.indiatimes.com/world/us/obsessed-with-weed-anti-ice-shooter-hated-us-govt-targeted-federal-agents-ex-boss-officials-reveal-details/articleshow/124144483.cms,World
37,Hong Kong lawmakers pass bill to ban substandard tiny apartments,TOI,https://timesofindia.indiatimes.com/world/china/hong-kong-lawmakers-pass-bill-to-ban-substandard-tiny-apartments/articleshow/124144002.cms,World
38,‘General Squid Games’: Pete Hegseth summons military top brass — triggers anxiety in DC,TOI,https://timesofindia.indiatimes.com/world/us/general-squid-games-pete-hegseth-summons-military-top-brass-triggers-anxiety-in-dc/articleshow/124143325.cms,World
39,Execution by nitrogen gas & lethal injection: Texas and Alabama carry out two deaths,TOI,https://timesofindia.indiatimes.com/world/us/execution-by-nitrogen-gas-lethal-injection-used-texas-and-alabama-carry-out-two-deaths-nine-more-scheduled-this-year/articleshow/124141351.cms,World
40,Phoenix-area shooting spree: Arizona man convicted of eight murders - All you need to know,TOI,https://timesofindia.indiatimes.com/world/us/phoenix-area-shooting-spree-arizona-man-convicted-of-eight-murders-all-you-need-to-know/articleshow/124140232.cms,World
41,"Lollapalooza effect! India's consumption spending set to soar: Policy trifecta of GST, tax, and rate cuts to fuel Rs 3 lakh crore surge",TOI,https://timesofindia.indiatimes.com/business/india-business/lollapalooza-effect-indias-consumption-spending-set-to-soar-policy-trifecta-of-gst-tax-and-rate-cuts-to-fuel-rs-3-lakh-crore-surge/articleshow/124155996.cms,Business
42,India-US trade deal: Commerce Ministry shares update on Piyush Goyal’s visit; says aim to ‘achieve early conclusion’,TOI,https://timesofindia.indiatimes.com/business/india-business/india-us-trade-deal-commerce-ministry-shares-update-on-piyush-goyals-visit-says-aim-to-achieve-early-conclusion/articleshow/124154344.cms,Business
43,"Reducing Russian crude imports: India wants US to allow oil from Iran, Venezuela; 25% penal tariffs in focus",TOI,https://timesofindia.indiatimes.com/business/india-business/reducing-russian-crude-imports-india-wants-us-to-allow-oil-from-iran-venezuela-25-penal-tariffs-in-focus/articleshow/124143600.cms,Business
44,Rare earth elements: President Murmu says India must become self-reliant; ‘important for ensuring national security’,TOI,https://timesofindia.indiatimes.com/business/india-business/rare-earth-elements-president-murmu-says-india-must-become-self-reliant-important-for-ensuring-national-security/articleshow/124153727.cms,Business
45,Boost for IAF! HAL looks to secure billion-dollar GE engine deal for LCA Tejas Mk1A; India-US defence ties in focus,TOI,https://timesofindia.indiatimes.com/business/india-business/boost-for-iaf-hal-looks-to-secure-billion-dollar-ge-engine-deal-for-lca-tejas-mk1a-india-us-defence-ties-in-focus/articleshow/124152977.cms,Business
46,Trump’s 100% tariffs on branded drugs: Which Indian pharma stocks are most vulnerable? Experts weigh in,TOI,https://timesofindia.indiatimes.com/business/india-business/trumps-100-tariffs-on-branded-drugs-which-indian-pharma-stocks-sun-pharma-cipla-dr-reddys-are-most-vulnerable-experts-weigh-in/articleshow/124150585.cms,Business
47,"Indian Railways revises contract conditions: Introduces localisation, price variation clauses; compliance with GST norms in focus",TOI,https://timesofindia.indiatimes.com/business/infrastructure/indian-railways-revises-contract-conditions-introduces-localisation-price-variation-clauses-compliance-with-gst-norms-in-focus/articleshow/124150486.cms,Business
48,Asian drug market stocks slides: Trump’s 100% pharmaceutical tariffs shake market; broader impact on Japan likely minimal,TOI,https://timesofindia.indiatimes.com/business/international-business/asian-drug-market-stocks-slides-trumps-100-pharmaceutical-tariffs-shake-market-broader-impact-on-japan-likely-minimal/articleshow/124149791.cms,Business
49,"Unclaimed money in mutual funds shot up 20% in 2024-25: Over Rs 3,400 crore of unclaimed dividend, redemptions lying with MFs, says SEBI",TOI,https://timesofindia.indiatimes.com/business/financial-literacy/investing/unclaimed-money-in-mutual-funds-shot-up-20-in-2024-25-over-rs-3400-crore-of-unclaimed-dividend-redemptions-lying-with-mfs-says-sebi/articleshow/124148412.cms,Business
50,"Gold price prediction: What's the outlook for September 26, 2025? Why a ‘sell on rise’ strategy makes sense",TOI,https://timesofindia.indiatimes.com/business/india-business/gold-price-prediction-today-what-is-the-gold-rate-outlook-for-september-26-2025-should-you-buy-or-sell-mcx-gold/articleshow/124147629.cms,Business
51,"Asian markets drop as Trump unveils new tariffs: Pharmaceutical and Biotech stocks hit; oil, gold prices climb",TOI,https://timesofindia.indiatimes.com/business/international-business/asian-markets-drop-as-trump-unveils-new-tariffs-pharmaceutical-and-biotech-stocks-hit-oil-gold-prices-climb/articleshow/124147209.cms,Business
52,"Trump’s 100% tariffs on pharma: Sun Pharma, Biocon, Cipla & other pharmaceutical stocks tank; jitters on D-Street",TOI,https://timesofindia.indiatimes.com/business/india-business/trumps-100-tariffs-on-pharma-sun-pharma-biocon-cipla-other-pharmaceutical-stocks-tank-jitters-on-d-street/articleshow/124144816.cms,Business
53,"Stock market crash today: Nifty50 ends below 24,700; BSE Sensex down over 700 points - top 5 reasons for market fall",TOI,https://timesofindia.indiatimes.com/business/india-business/stock-market-today-nifty50-bse-sensex-september-26-2025-donald-trump-pharma-tariffs-h-1b-visa-fee-india-us-trade-deal/articleshow/124142314.cms,Business
54,"Top stocks to buy today: Stock recommendations for September 26, 2025 - check list",TOI,https://timesofindia.indiatimes.com/business/india-business/top-stock-recommendations-for-september-26-2025-sagility-hindustan-zinc-bank-stocks-to-buy-today/articleshow/124141962.cms,Business
55,Buy or sell: Stock recommendation by brokers for September 26,TOI,https://timesofindia.indiatimes.com/business/india-business/buy-or-sell-stock-recommendation-by-brokers-for-september-26/articleshow/124140804.cms,Business
56,"100% on pharma products, 50% on kitchen cabinets: Donald Trump announces series of tariffs - check list",TOI,https://timesofindia.indiatimes.com/business/international-business/100-on-pharma-products-50-on-kitchen-cabinets-donald-trump-announces-series-of-tariffs-check-list/articleshow/124139304.cms,Business
57,"'Logistics cost at 8% of GDP, more burden on small cos'",TOI,https://timesofindia.indiatimes.com/business/india-business/logistics-cost-at-8-of-gdp-more-burden-on-small-cos/articleshow/124137055.cms,Business
58,Just 5% of US staff on H-1B visas: Accenture,TOI,https://timesofindia.indiatimes.com/business/india-business/just-5-of-us-staff-on-h-1b-visas-accenture/articleshow/124136460.cms,Business
59,Rupee invoicing picking up in Middle East: StanChart's Singh,TOI,https://timesofindia.indiatimes.com/business/india-business/rupee-invoicing-picking-up-in-middle-east-stancharts-singh/articleshow/124135759.cms,Business
60,"Step up lending for public infra, MSMEs: FM Sitharaman to banks",TOI,https://timesofindia.indiatimes.com/business/india-business/step-up-lending-for-public-infra-msmes-fm-sitharaman-to-banks/articleshow/124134833.cms,Business
61,'If Pakistan get Abhishek Bachchan out early': Akhtar's masterplan for India,TOI,https://timesofindia.indiatimes.com/sports/cricket/asia-cup/if-pakistan-get-abhishek-bachchan-out-early-on-shoaib-akhtars-masterplan-for-asia-cup-final-against-india-goes-viral/articleshow/124154957.cms,Sports
62,War of words! Kaif responds to Jasprit Bumrah: 'Take it as a.. ',TOI,https://timesofindia.indiatimes.com/sports/cricket/asia-cup/war-of-words-mohammad-kaif-responds-to-jasprit-bumrah-take-it-as-a-/articleshow/124154144.cms,Sports
63,"Rahul helps India A create history, register highest successful chase ever",TOI,https://timesofindia.indiatimes.com/sports/cricket/news/kl-rahuls-176-helps-india-a-create-history-register-highest-successful-chase-ever-against-australia-a/articleshow/124155382.cms,Sports
64,"Bangladesh paid the price vs Pakistan, will India regret catches dropped next?",TOI,https://timesofindia.indiatimes.com/sports/cricket/asia-cup/bangladesh-paid-the-price-vs-pakistan-will-india-regret-catches-dropped-next/articleshow/124152088.cms,Sports
65,Usain Bolt reveals cricket inspired his sprinting success: 'I was a huge fan',TOI,https://timesofindia.indiatimes.com/sports/cricket/news/usain-bolt-reveals-cricket-inspired-his-sprinting-success-i-was-a-huge-fan/articleshow/124156846.cms,Sports
66,In dire need of runs: Suryakumar Yadav's poor form a big concern for India,TOI,https://timesofindia.indiatimes.com/sports/cricket/asia-cup/in-dire-need-of-runs-suryakumar-yadavs-poor-form-a-big-concern-for-india-in-asia-cup/articleshow/124143926.cms,Sports
67,Pakistan coach fires stern warning to India before Asia Cup final clash in Dubai,TOI,https://timesofindia.indiatimes.com/sports/cricket/asia-cup/pakistan-coach-fires-stern-warning-to-india-before-asia-cup-final-clash-in-dubai/articleshow/124137757.cms,Sports
68,'Pata chal raha hai...': Pathan roasts Pakistan's fielding - video,TOI,https://timesofindia.indiatimes.com/sports/cricket/asia-cup/pata-chal-raha-hai-pakistan-is-fielding-irfan-pathan-roasts-men-in-green-for-shambolic-effort-video/articleshow/124146978.cms,Sports
69,Massive statement! Pakistan captain Salman Ali drops bombshell on India ahead of Asia Cup final,TOI,https://timesofindia.indiatimes.com/sports/cricket/asia-cup/massive-statement-pakistan-captain-salman-ali-agha-drops-bombshell-on-india-ahead-of-asia-cup-final/articleshow/124138053.cms,Sports
70,STAT CHECK: What is India's record vs Pakistan in tournament finals?,TOI,https://timesofindia.indiatimes.com/sports/cricket/asia-cup/india-have-a-disappointing-record-against-pakistan-in-tournament-finals/articleshow/124141949.cms,Sports
71,'Mark my words': Akhtar tells Pakistan how to beat India in Asia Cup final,TOI,https://timesofindia.indiatimes.com/sports/cricket/asia-cup/mark-my-words-shoaib-akhtar-tells-pakistan-how-to-beat-india-in-asia-cup-final/articleshow/124143541.cms,Sports
72,'Alimony claims are false': Dhanashree breaks silence on her divorce from Chahal,TOI,https://timesofindia.indiatimes.com/sports/off-the-field/alimony-claims-are-false-dhanashree-verma-breaks-silence-on-her-divorce-from-yuzvendra-chahal/articleshow/124150681.cms,Sports
73,Big relief for India: Pacer Arundhati Reddy is 'fit & fine',TOI,https://timesofindia.indiatimes.com/sports/cricket/news/big-relief-for-india-pacer-arundhati-reddy-is-fit-fine/articleshow/124151655.cms,Sports
74,'Tests your nerves': R Praggnanandhaa plays jenga with friends to unwind - watch,TOI,https://timesofindia.indiatimes.com/sports/chess/tests-your-nerves-r-praggnanandhaa-plays-jenga-with-friends-to-unwind-watch/articleshow/124148780.cms,Sports
75,"Vaibhav Suryavanshi smashes two sixes, but shocking dismissal stuns fans vs Australia U19",TOI,https://timesofindia.indiatimes.com/sports/cricket/news/vaibhav-suryavanshi-smashes-two-sixes-but-shocking-dismissal-stuns-fans-vs-australia-u19/articleshow/124146794.cms,Sports
76,"IND vs WI: Star pacer ruled out of Test series, replacement announced",TOI,https://timesofindia.indiatimes.com/sports/cricket/india-vs-west-indies/ind-vs-wi-star-pacer-ruled-out-of-test-series-replacement-announced/articleshow/124147007.cms,Sports
77,'India ko chhodna nahi' – Pakistani fan goes viral shaking hands with Haris Rauf ahead of Asia Cup final,TOI,https://timesofindia.indiatimes.com/sports/cricket/asia-cup/india-ko-chhodna-nahi-pakistani-fan-goes-viral-shaking-hands-with-haris-rauf-ahead-of-asia-cup-final/articleshow/124138987.cms,Sports
78,"Renewed focus, new variations, Morkel’s support: How Dube stepped up as a bowler",TOI,https://timesofindia.indiatimes.com/sports/cricket/asia-cup/renewed-focus-new-variations-morne-morkels-support-how-shivam-dube-stepped-up-as-a-bowler/articleshow/124143473.cms,Sports
79,MLS: Inter Miami midfielder Busquets announces retirement date,TOI,https://timesofindia.indiatimes.com/sports/football/top-stories/major-league-soccer-sergio-busquets-announces-retirement-date/articleshow/124145682.cms,Sports
80,UFC at White House: Conor McGregor lists shocking demands for fight,TOI,https://timesofindia.indiatimes.com/sports/more-sports/others/ufc-at-white-house-conor-mcgregor-lists-shocking-demands-for-fight/articleshow/124144964.cms,Sports
81,Kannada writer S.L. Bhyrappa cremated with State honours in Mysuru,Hindu,https://www.thehindu.com/news/national/karnataka/kannada-writer-sl-bhyrappa-cremated-with-state-honours-in-mysuru/article70097265.ece,National
82,"Karnataka CM instructs DCs, CEOs, enumerators to expedite Social and Educational Survey, rules out extension of deadline",Hindu,https://www.thehindu.com/news/national/karnataka/karnataka-cm-instructs-dcs-ceos-enumerators-to-expedite-social-and-educational-survey-rules-out-extension-of-deadline/article70097310.ece,National
83,Watch: India is the now fifth country to produce and manufacture telecom equipment: Scindia,Hindu,https://www.thehindu.com/shorts/watch-india-is-the-now-fifth-country-to-produce-and-manufacture-telecom-equipment-scindia/article70097486.ece,National
84,Congress demands Palaniswami’s apology for remarks against TNCC president,Hindu,https://www.thehindu.com/news/national/tamil-nadu/congress-demands-palaniswamis-apology-for-remarks-against-tncc-president/article70097312.ece,National
85,No action against IAS officer Smita Sabharwal till October 7: Telangana HC,Hindu,https://www.thehindu.com/news/national/telangana/no-action-against-ias-officer-smita-sabharwal-till-october-7-telangana-hc/article70093764.ece,National
86,Climate activist Sonam Wangchuk arrested in Leh,Hindu,https://www.thehindu.com/news/national/ladakh/climate-activist-sonam-wangchuk-arrested-in-leh/article70097428.ece,National
87,Odonate survey finds 5 new species in Thiruvananthapuram division,Hindu,https://www.thehindu.com/news/national/kerala/odonate-survey-finds-5-new-species-in-thiruvananthapuram-division/article70093978.ece,National
88,NIA invokes UAPA against father-son Maoist duo in Chhattisgarh BJP leader’s murder case,Hindu,https://www.thehindu.com/news/national/chhattisgarh/nia-invokes-uapa-against-father-son-maoist-duo-in-chhattisgarh-bjp-leaders-murder-case/article70097185.ece,National
89,"DMK obsessed with publicity, ignoring noon meal scheme issues: Nainar Nagenthran",Hindu,https://www.thehindu.com/news/national/tamil-nadu/dmk-obsessed-with-publicity-ignoring-noon-meal-scheme-issues-nainar-nagenthran/article70097298.ece,National
90,Tirumala Brahmotsavams transform into a tapestry of the country’s folk heritage,Hindu,https://www.thehindu.com/news/national/andhra-pradesh/tirumala-brahmotsavams-transform-into-a-tapestry-of-the-countrys-folk-heritage/article70097347.ece,National
91,Opening suspect sheets in force since BNS introduction; only 1 social media offender among 79 suspect sheets: Telangana Police,Hindu,https://www.thehindu.com/news/national/telangana/opening-suspect-sheets-in-force-since-bns-introduction-only-1-social-media-offender-among-79-suspect-sheets-telangana-police/article70093948.ece,National
92,"Kerala Opposition Leader V.D. Satheesan accuses CPI(M) of aiding communal forces, vows to defend secular values",Hindu,https://www.thehindu.com/news/national/kerala/kerala-opposition-leader-vd-satheesan-accuses-cpim-of-aiding-communal-forces-vows-to-defend-secular-values/article70097214.ece,National
93,"Dulquer Salmaan moves Kerala High Court, challenges Customs seizure of high-end car",Hindu,https://www.thehindu.com/news/national/kerala/dulquer-salmaan-moves-kerala-high-court-challenges-customs-seizure-of-high-end-car/article70097327.ece,National
94,"Need personal and professional integrity, transparency, adherence to rules: Neeraj Kumar Dohare, Sr. DGM of Central Railway",Hindu,https://www.thehindu.com/news/national/karnataka/need-personal-and-professional-integrity-transparency-adherence-to-rules-neeraj-kumar-dohare-sr-dgm-of-central-railway/article70077139.ece,National
