S.No,Headline,Source,Link,Category
95,Supreme Court defers Vodafone Idea plea against extra AGR demand to October 6,Hindu,https://www.thehindu.com/news/national/supreme-court-defers-vodafone-idea-plea-against-extra-agr-demand-to-october-6/article70097233.ece,National
96,In pictures | MiG-21 flies one last time,Hindu,https://www.thehindu.com/photos/in-pictures-mig-21-flies-one-last-time/article70097156.ece,National
97,Telangana ranks first in rainwater harvesting; 5.20 lakh works taken up in 2024-25,Hindu,https://www.thehindu.com/news/national/telangana/telangana-ranks-first-in-rainwater-harvesting-520-lakh-works-taken-up-in-2024-25/article70094514.ece,National
98,Allahabad HC junks Rahul Gandhi’s plea against Varanasi court orders on his remarks in U.S. on Sikh community,Hindu,https://www.thehindu.com/news/national/rahul-gandhi-us-speech-sikhs-allahabad-hc-varanasi-court-order-fir-plea/article70097254.ece,National
99,Two killed as motorcycle rams tree near Villupuram,Hindu,https://www.thehindu.com/news/national/tamil-nadu/two-killed-as-motorcycle-rams-tree-near-villupuram/article70096734.ece,National
100,Madras High Court directs Sony Music to disclose revenue from ‘exploiting’ Ilaiyaraaja’s songs,Hindu,https://www.thehindu.com/news/national/tamil-nadu/madras-high-court-directs-sony-music-to-disclose-revenue-from-exploiting-ilaiyaraajas-songs/article70096780.ece,National
101,Nitish Katara murder: Supreme Court refuses to extend interim bail of convict Vikas Yadav,Hindu,https://www.thehindu.com/news/national/nitish-katara-murder-supreme-court-refuses-to-extend-interim-bail-of-convict-vikas-yadav/article70097260.ece,National
102,Hyderabad Rain September 26 | Gates of Osman Sagar and Himayatsagar lifted; 55 people evacuated by GHMC,Hindu,https://www.thehindu.com/news/cities/Hyderabad/hyderabad-rain-september-26-gates-of-osman-sagar-and-himayatsagar-lifted-55-people-evacuated-by-ghmc/article70097221.ece,National
103,"Dasara holidays for all Telangana Intermediate colleges from September 27, institutes to reopen on October 6",Hindu,https://www.thehindu.com/news/national/telangana/dasara-holidays-for-all-telangana-intermediate-colleges-from-september-27-to-october-6/article70097190.ece,National
104,Delhi Court reserves order on pre-arrest bail plea of self-styled godman Chaitanyananda Saraswati in forgery case,Hindu,https://www.thehindu.com/news/national/delhi-court-chaitanyananda-saraswati-self-styled-godman-pre-arrest-bail-verdict-reserved/article70097215.ece,National
105,Andhra Pradesh Governor Abdul Nazeer visits Kanaka Durga temple,Hindu,https://www.thehindu.com/news/national/andhra-pradesh/andhra-pradesh-governor-abdul-nazeer-visits-kanaka-durga-temple/article70096999.ece,National
106,"Government says India held ‘constructive’ meetings in the U.S., does not reveal date of next official meeting",Hindu,https://www.thehindu.com/business/Economy/india-held-constructive-meetings-in-us-does-not-reveal-date-of-next-official-negotiation-round-government/article70097198.ece,National
107,"Karnataka rain: MP to distribute 2,500 food kits to flood-hit villagers in Kalaburagi",Hindu,https://www.thehindu.com/news/national/karnataka/karnataka-rain-mp-to-distribute-2500-food-kits-to-flood-hit-villagers-in-kalaburagi/article70093904.ece,National
108,KCR announces Maganti Sunitha as BRS candidate for Jubilee Hills by-poll,Hindu,https://www.thehindu.com/news/national/telangana/kcr-announces-maganti-sunitha-as-brs-candidate-for-jubilee-hills-by-poll/article70097040.ece,National
109,Kerala High Court directs government to decide on corruption probe against P.P. Divya within two months,Hindu,https://www.thehindu.com/news/national/kerala/kerala-high-court-directs-government-to-decide-on-corruption-probe-against-pp-divya-within-two-months/article70096962.ece,National
110,Mysore Sandal Soap is now the fragrance partner for Kantara – Chapter 1,Hindu,https://www.thehindu.com/news/national/karnataka/mysore-sandal-soap-is-now-the-fragrance-partner-for-kantara-chapter-1/article70096945.ece,National
111,"Complete ban on firecrackers doesn’t work, need balanced approach: Supreme Court",Hindu,https://www.thehindu.com/news/national/complete-ban-on-firecrackers-doesnt-work-need-balanced-approach-supreme-court/article70097032.ece,National
112,Supreme Court directs preservation of body of top Maoist commander Katha Ramchandra Reddy killed in police encounter,Hindu,https://www.thehindu.com/news/national/supreme-court-directs-preservation-of-body-of-top-maoist-commander-katha-ramchandra-reddy-killed-in-police-encounter/article70097074.ece,National
113,Karnataka socio-educational survey: Kodavas confused over how to record religious identity,Hindu,https://www.thehindu.com/news/national/karnataka/kodavas-confused-over-how-to-record-religious-identity-in-socio-economic-survey-in-karnataka/article70093395.ece,National
114,"Police seize MDMA, ganja after dramatic car chase in Kerala’s Kasaragod",Hindu,https://www.thehindu.com/news/national/kerala/police-seize-mdma-ganja-after-dramatic-car-chase-in-keralas-kasaragod/article70097029.ece,National
115,"Rajnath Singh bids farewell to MiG-21, calls it symbol of India-Russia ties",Hindu,https://www.thehindu.com/news/national/mig-21-added-many-proud-moments-in-military-aviation-journey-says-rajnath-singh/article70097114.ece,National
116,Supreme Court stays Andhra Pradesh HC order faulting CBI director over Tirupati ‘adulterated ghee’ probe,Hindu,https://www.thehindu.com/news/national/supreme-court-stays-andhra-pradesh-hc-order-faulting-cbi-director-over-tirupati-adulterated-ghee-probe/article70096877.ece,National
117,Pray to Maa Durga that 'Sonar Bangla' glory is restored by new Govt post 2026 polls: Amit Shah in Kolkata,Hindu,https://www.thehindu.com/news/cities/kolkata/amit-shah-bengal-polls-2026-kolkata-visit-tmc-bjp/article70097023.ece,National
118,"Bengal school jobs ‘scam’: Calcutta HC grants bail to former Minister Partha Chatterjee, unlikely to walk out of jail just yet",Hindu,https://www.thehindu.com/news/cities/kolkata/bengal-school-jobs-scam-partha-chatterjee-bail-jail-durga-puja-calcutta-hc/article70096987.ece,National
119,Man dies after village headman in Uttar Pradesh opens fire at his child's naming ceremony,Hindu,https://www.thehindu.com/news/national/uttar-pradesh/man-dies-after-village-headman-in-uttar-pradesh-opens-fire-at-his-childs-naming-ceremony/article70096895.ece,National
120,"Eleven shops gutted in fire accident in Santapeta, Nellore in Andhra Pradesh",Hindu,https://www.thehindu.com/news/national/andhra-pradesh/eleven-shops-gutted-in-fire-accident-in-santapeta-nellore-in-andhra-pradesh/article70096722.ece,National
121,Ladakh protests: what do protesters want?,Hindu,https://www.thehindu.com/news/national/ladakh/ladakh-protests-why-did-clashes-erupt-in-leh-and-what-do-protesters-want/article70096721.ece,National
122,Watch: Telangana model for Bihar: Deputy CM Mallu Bhatti Vikramarka on backward caste reforms,Hindu,https://www.thehindu.com/shorts/watch-telangana-model-for-bihar-deputy-cm-mallu-bhatti-vikramarka-on-backward-caste-reforms/article70094743.ece,National
123,‘Jal Prahar 2025’ concludes with Indian Navy’s successful two-phase joint amphibious exercise with Army,Hindu,https://www.thehindu.com/news/cities/Visakhapatnam/jal-prahar-2025-concludes-with-indian-navys-successful-two-phase-joint-amphibious-exercise-with-army/article70096845.ece,National
124,Amit Shah inaugurates Durga Pujas in Kolkata while invoking political change in West Bengal,Hindu,https://www.thehindu.com/news/national/west-bengal/pray-to-maa-durga-there-is-a-new-government-restoring-west-bengals-lost-sonar-bangla-glory-post-polls-says-amit-shah/article70096856.ece,National
125,Supreme Court dismisses plea seeking ban on Salman Rushdie’s novel ‘The Satanic Verses’,Hindu,https://www.thehindu.com/news/national/supreme-court-dismisses-plea-seeking-ban-on-salman-rushdies-novel-the-satanic-verses/article70096837.ece,National
126,Civil police officer on duty killed in Kasaragod accident,Hindu,https://www.thehindu.com/news/national/kerala/civil-police-officer-on-duty-killed-in-kasaragod-accident/article70096382.ece,National
127,"1,000 kidney transplants and counting at Chennai’s Stanley Hospital",Hindu,https://www.thehindu.com/news/cities/chennai/1000-kidney-transplants-and-counting-at-chennais-stanley-hospital/article70074612.ece,National
128,Delhi HC questions Sameer Wankhede over maintainability of defamation plea against Aryan Khan’s ‘Ba***ds of Bollywood’ series,Hindu,https://www.thehindu.com/news/national/sameer-wankhede-delhi-hc-aryan-khan-srk-bads-of-bollywood-defamation-plea-questioned/article70096775.ece,National
129,"PM Modi launches Bihar’s employment scheme by transferring ₹10,000 each into the bank accounts of 75 lakh women",Hindu,https://www.thehindu.com/elections/bihar-assembly/pm-modi-launches-bihars-mukhyamantri-mahila-rojgar-yojana/article70096776.ece,National
130,Gujarat Police to recruit transgender people as traffic marshal,Hindu,https://www.thehindu.com/news/national/gujarat/gujarat-police-to-recruit-transgender-people-as-traffic-marshal/article70093249.ece,National
131,Curfew remains in force for third day in Leh town,Hindu,https://www.thehindu.com/news/national/ladakh/curfew-remains-in-force-for-third-day-in-leh-town/article70096733.ece,National
132,"Botanical Survey of India gets a new director, the first mycologist to head the institute",Hindu,https://www.thehindu.com/news/cities/kolkata/botanical-survey-of-india-gets-a-new-director-the-first-mycologist-to-head-the-institute/article70094199.ece,National
133,West Bengal school jobs case: Calcutta High Court grants bail to former Minister Partha Chatterjee,Hindu,https://www.thehindu.com/news/national/west-bengal/west-bengal-school-jobs-case-calcutta-high-court-grants-bail-to-former-minister-partha-chatterjee/article70096624.ece,National
134,"MiG-21 flies through Indian skies for last time, Rajnath Singh terms it ‘national pride’",Hindu,https://www.thehindu.com/news/national/india-bids-farewell-to-the-iconic-mig-21-fighter-aircraft-in-chandigarh/article70096702.ece,National
135,Chhattisgarh High Court asks CBI to resume probe in five year old case of embezzlement,Hindu,https://www.thehindu.com/news/national/chhattisgarh/chhattisgarh-high-court-asks-cbi-to-resume-probe-in-five-year-old-case-of-embezzlement/article70094184.ece,National
136,"Siddalinga Swami to approach High Court of Karnataka seeking action against district authorities, sand panel",Hindu,https://www.thehindu.com/news/national/karnataka/siddalinga-swami-to-approach-high-court-of-karnataka-seeking-action-against-district-authorities-sand-panel/article70093926.ece,National
137,Kerala rains: IMD sounds orange alert for four districts,Hindu,https://www.thehindu.com/news/national/kerala/kerala-rains-imd-sounds-orange-alert-for-four-districts-in-kerala/article70096643.ece,National
138,Accessibility and Durga Pujas: How accessible are pandals in Kolkata,Hindu,https://www.thehindu.com/news/cities/kolkata/durga-puja-pandals-kolkata-accessibility-special-needs-security-disability-women-children-bengal/article70093715.ece,National
139,Three IndiGo flights bound for Hyderabad diverted to Vijayawada due to poor visibility,Hindu,https://www.thehindu.com/news/cities/Hyderabad/three-indigo-flights-bound-for-hyderabad-diverted-to-vijayawada-due-to-poor-visibility/article70096613.ece,National
140,Seer appeals to Deeksha Panchamsalis to register caste as Lingayat Panchamasali in Karnataka survey,Hindu,https://www.thehindu.com/news/national/karnataka/seer-appeals-to-deeksha-panchamsalis-to-register-caste-as-lingayat-panchamasali-in-karnataka-survey/article70094321.ece,National
141,Visakhapatnam’s anti-encroachment drive | Caught between changing cityscape and shattered livelihoods,Hindu,https://www.thehindu.com/news/national/andhra-pradesh/operation-lungs-20-caught-between-changing-cityscape-and-shattered-livelihoods/article70093483.ece,National
142,Tribal groups oppose Assam-Meghalaya hydropower project,Hindu,https://www.thehindu.com/news/national/assam/tribal-groups-oppose-assam-meghalaya-hydropower-project/article70096510.ece,National
143,"Three tier-II airports in Karnataka record growth in passenger numbers, three see drop",Hindu,https://www.thehindu.com/news/national/karnataka/three-tier-ii-airports-in-karnataka-record-growth-in-passenger-numbers-three-see-drop/article70093604.ece,National
144,"Ramadoss announces protest for caste count, Vanniyar quota",Hindu,https://www.thehindu.com/news/national/tamil-nadu/ramadoss-announces-protest-for-caste-count-vanniyar-quota/article70093303.ece,National
145,The slowly dying American dream,Hindu,https://www.thehindu.com/news/national/telangana/us-visa-h1b-policy-trump-telangana-jobs-ameerpet-hyderabad-careers/article70095055.ece,National
146,Early morning rain disrupts life in Hyderabad on September 26; Cyberabad traffic police issue work-from-home advisory,Hindu,https://www.thehindu.com/news/cities/Hyderabad/early-morning-rain-disrupts-life-in-hyderabad-on-september-26-cyberabad-traffic-police-issue-work-from-home-advisory/article70096305.ece,National
147,"Cauvery Aarti: Entry fee, vehicle toll for Brindavan Gardens waived, free laddoos for visitors",Hindu,https://www.thehindu.com/news/national/karnataka/cauvery-aarti-entry-fee-vehicle-toll-for-brindavan-gardens-waived-free-laddoos-for-visitors-karnataka/article70096403.ece,National
148,"World requires global workforce, can’t escape this reality, says Jaishankar",Hindu,https://www.thehindu.com/news/national/world-requires-global-workforce-cant-escape-this-reality-says-jaishankar/article70096408.ece,National
149,"Yamuna water quality improves, as flood waters flush out pollutants",Hindu,https://www.thehindu.com/news/cities/Delhi/yamuna-water-quality-improves-as-flood-waters-flush-out-pollutants/article70096387.ece,National
150,Odisha puts districts on high alert for heavy rain as low-pressure area forms over Bay of Bengal,Hindu,https://www.thehindu.com/news/national/odisha/odisha-puts-districts-on-high-alert-for-heavy-rain-as-low-pressure-area-forms-over-bay-of-bengal/article70096341.ece,National
151,Toddler dies after gate topples on him in Kerala’s Alappuzha,Hindu,https://www.thehindu.com/news/national/kerala/toddler-dies-after-gate-topples-on-him-in-keralas-alappuzha/article70096296.ece,National
152,"India sends fresh aid to quake-hit Afghanistan, relief reaches Kabul via Chabahar",Hindu,https://www.thehindu.com/news/national/india-sends-fresh-aid-to-quake-hit-afghanistan-relief-reaches-kabul-via-chabahar/article70096343.ece,National
153,"Watch: State governments’ pockets are ‘empty’, how will spending happen?”: K. N. Balagopal | The Hindu Mind",Hindu,https://www.thehindu.com/shorts/watch-state-governments-pockets-are-empty-how-will-spending-happen-k-n-balagopal-the-hindu-mind/article70094721.ece,National
154,Of men and their flying machines: Pilots hail legacy as MiG-21 prepares for swansong,Hindu,https://www.thehindu.com/news/national/of-men-and-their-flying-machines-pilots-hail-legacy-as-mig-21-prepares-for-swansong/article70096311.ece,National
155,Counting of votes for Assam’s BTC election begins,Hindu,https://www.thehindu.com/news/national/assam/assam-btc-polls-bodoland-territorial-council-vote-counting-september-26-2025/article70096289.ece,National
156,The right to be cool in a sweltering Global South,Hindu,https://www.thehindu.com/sci-tech/energy-and-environment/the-right-to-be-cool-in-a-sweltering-south/article70093081.ece,National
157,Why India’s urban definition is failing its growing towns,Hindu,https://www.thehindu.com/news/national/why-indias-urban-definition-is-failing-its-growing-towns/article70093149.ece,National
158,"Citizens, domicile, and migrants: Why we should worry about Provincial Citizenship",Hindu,https://www.thehindu.com/news/national/citizens-domicile-and-migrants-why-we-should-worry-about-provincial-citizenship/article70093407.ece,National
159,Telangana CM to hand over Group-I appointment orders on September 27,Hindu,https://www.thehindu.com/news/national/telangana/telangana-cm-to-hand-over-group-i-appointment-orders-on-september-27/article70094552.ece,National
160,ED questions actor Jagapati Babu in Sahiti Infra fraud probe,Hindu,https://www.thehindu.com/news/national/telangana/ed-questions-actor-jagapati-babu-in-sahiti-infra-fraud-probe/article70094931.ece,National
161,HMR Phase 1 handover likely next year as L&T’s 15-year Metro journey nears end,Hindu,https://www.thehindu.com/news/national/telangana/hmr-phase-1-handover-likely-next-year-as-lts-15-year-metro-journey-nears-end/article70094774.ece,National
162,Counting on change: Karnataka’s long overdue survey of gender minorities,Hindu,https://www.thehindu.com/news/cities/bangalore/counting-on-change/article70089110.ece,National
163,"Rains LIVE: Andhra Pradesh braces for heavy rain, winds; Minister orders preparedness",Hindu,https://www.thehindu.com/news/national/rain-odisha-kerala-andhra-pradesh-weather-kolkata-flood-live-updates-september-26-2025/article70096241.ece,National
164,IMD issues orange alert for eight districts in Kerala,Hindu,https://www.thehindu.com/news/national/kerala/kerala-weather-imd-rain-alert-updates-september-26/article70096235.ece,National
165,"Ladakh violence: J&K CM Abdullah defends Congress, accuses BJP of blaming others for its failures",Hindu,https://www.thehindu.com/news/national/ladakh/ladakh-violence-jk-cm-abdullah-defends-congress-accuses-bjp-of-blaming-others-for-its-failures/article70096204.ece,National
166,Rajasthan man arrested on charges of espionage for Pakistan in Jaisalmer,Hindu,https://www.thehindu.com/news/national/rajasthan/man-arrested-on-charges-of-espionage-in-rajasthans-jaisalmer/article70096200.ece,National
167,"The megalithic dolmens of Kodaikanal dating back to 5,000 years",Hindu,https://www.thehindu.com/news/national/tamil-nadu/the-megalithic-dolmens-of-kodaikanal-dating-back-to-5000-years/article70092739.ece,National
168,A rare 200-year-old Navaratri custom in which deities are taken from Tamil Nadu to Kerala,Hindu,https://www.thehindu.com/news/national/tamil-nadu/a-rare-200-year-old-navaratri-custom-continues-deities-are-taken-from-tamil-nadu-kanniyakumari-to-kerala-thiruvananthapuram/article70092771.ece,National
169,The Defence Services Staff College in Wellington and its long association with soldiers,Hindu,https://www.thehindu.com/news/national/tamil-nadu/the-defence-services-staff-college-in-wellington-coonoor-and-its-long-association-with-soldiers/article70092797.ece,National
170,"Terrorism ‘persistent threat’ to development, says EAM Jaishankar in G20 Foreign Ministers’ meeting",Hindu,https://www.thehindu.com/news/national/terrorism-persistent-threat-to-development-eam-jaishankar/article70096194.ece,National
171,Chennai’s residential market shows signs of positive growth,Hindu,https://www.thehindu.com/news/national/tamil-nadu/chennais-residential-market-shows-signs-of-positive-growth/article70094374.ece,National
172,Commerce Department at Ethiraj College for Women celebrates its golden jubilee,Hindu,https://www.thehindu.com/news/national/tamil-nadu/commerce-department-at-ethiraj-college-for-women-celebrates-its-golden-jubilee/article70094135.ece,National
173,Three youths killed in road accident near Chengam,Hindu,https://www.thehindu.com/news/national/tamil-nadu/three-youths-killed-in-road-accident-near-chengam/article70093344.ece,National
174,"Mass cleanup drive at Fort garden, parapet wall in Vellore",Hindu,https://www.thehindu.com/news/national/tamil-nadu/mass-cleanup-drive-at-fort-garden-parapet-wall-in-vellore/article70093326.ece,National
175,Police seize four tonnes of PDS rice at Jolarpet railway station,Hindu,https://www.thehindu.com/news/national/tamil-nadu/police-seize-four-tonnes-of-pds-rice-at-jolarpet-railway-station/article70093336.ece,National
176,UPSC meet to finalise panel of three DGPs today,Hindu,https://www.thehindu.com/news/national/tamil-nadu/upsc-meet-to-finalise-panel-of-three-dgps-today/article70094407.ece,National
177,Mohan Majhi government plans to strengthen cooperative movement in Odisha in a big way,Hindu,https://www.thehindu.com/news/national/odisha/mohan-majhi-government-plans-to-strengthen-cooperative-movement-in-odisha-in-a-big-way/article70094277.ece,National
178,"Six arrested in Amritsar with 4 k.g. heroin, 2 pistols: Punjab Police",Hindu,https://www.thehindu.com/news/national/punjab/six-arrested-in-amritsar-with-4-kg-heroin-2-pistols-punjab-police/article70094963.ece,National
179,"Outrage over infant deaths in Indore | In India’s cleanest city, rats in a hospital",Hindu,https://www.thehindu.com/news/national/madhya-pradesh/outrage-over-infant-deaths-in-indore-in-indias-cleanest-city-rats-in-a-hospital/article70082058.ece,National
180,Maharashtra rains: CM seeks ‘substantial’ Central assistance,Hindu,https://www.thehindu.com/news/cities/mumbai/maharashtra-rains-cm-seeks-substantial-central-assistance/article70095155.ece,National
181,At least three dead as Tropical Storm Bualoi sweeps through Philippines,Hindu,https://www.thehindu.com/news/international/tropical-storm-bualoi-sweeps-through-philippines-casualities/article70097502.ece,International
182,Turkey's Erdogan hails 'meaningful progress' in his talks with Trump,Hindu,https://www.thehindu.com/news/international/turkeys-erdogan-hails-meaningful-progress-in-his-talks-with-trump/article70097387.ece,International
183,"Interpol busts online romance scams in Africa, 260 suspects arrested",Hindu,https://www.thehindu.com/news/international/interpol-busts-online-romance-scams-in-africa-260-suspects-arrested/article70097126.ece,International
184,11 of family killed in accident in Pakistan's Khyber Pakhtunkhwa,Hindu,https://www.thehindu.com/news/international/11-of-family-killed-in-accident-in-pakistans-khyber-pakhtunkhwa/article70097184.ece,International
185,Israel’s Benjamin Netanyahu to address U.N. as pressure mounts over Gaza war,Hindu,https://www.thehindu.com/news/international/israel-prime-minister-benjamin-netanyahu-address-at-unga/article70097141.ece,International
186,Turkish Airlines to expand fleet with 225 new Boeing aircraft after Tayyip Erdogan's U.S. visit,Hindu,https://www.thehindu.com/news/international/turkish-airlines-to-expand-fleet-with-225-new-boeing-aircraft-after-tayyip-erdogans-us-visit/article70096965.ece,International
187,"Slovenia bans Israeli Prime Minister Netanyahu from entering, citing ICC arrest warrant",Hindu,https://www.thehindu.com/news/international/slovenia-bans-israeli-prime-minister-netanyahu-from-entering-citing-icc-arrest-warrant/article70096777.ece,International
188,Halal concerns drive vaccine hesitancy as Indonesia fights measles outbreak,Hindu,https://www.thehindu.com/news/international/halal-concerns-drive-vaccine-hesitancy-as-indonesia-fights-measles-outbreak/article70096789.ece,International
189,Britain to introduce compulsory digital ID for workers,Hindu,https://www.thehindu.com/news/international/britain-to-introduce-compulsory-digital-id-for-workers/article70096809.ece,International
190,World leaders step up efforts behind scenes at U.N. to end war in Sudan,Hindu,https://www.thehindu.com/news/international/world-leaders-step-up-efforts-behind-scenes-at-un-to-end-war-in-sudan/article70096720.ece,International
191,73-year-old 'undocumented' Sikh woman deported from U.S. after 33 years,Hindu,https://www.thehindu.com/news/international/sikh-woman-us-india-deportation-undocumented-la-ice-officials-lawyer/article70096534.ece,International
192,Watch | Close to securing a peace deal in Gaza: Trump after meeting Erdogan in White House,Hindu,https://www.thehindu.com/shorts/watch-close-to-securing-a-peace-deal-in-gaza-trump-after-meeting-erdogan-in-white-house/article70096639.ece,International
193,Texas man executed for the ’exorcism’ killing of his girlfriend’s 13-month-old daughter,Hindu,https://www.thehindu.com/news/international/texas-man-executed-for-the-exorcism-killing-of-his-girlfriends-13-month-old-daughter/article70096349.ece,International
194,"Donald Trump’s drug tariff spares generics, but India braces for fallout",Hindu,https://www.thehindu.com/news/international/donald-trumps-drug-tariff-spares-generics-but-india-braces-for-fallout/article70096294.ece,International
195,The right to be cool in a sweltering Global South,Hindu,https://www.thehindu.com/sci-tech/energy-and-environment/the-right-to-be-cool-in-a-sweltering-south/article70093081.ece,International
196,Trump hosts Turkiye's Erdogan at U.S. considers lifting a ban on F-35 sales to NATO ally,Hindu,https://www.thehindu.com/news/international/trump-hosts-turkiyes-erdogan-at-us-considers-lifting-a-ban-on-f-35-sales-to-nato-ally/article70096217.ece,International
197,"Man who fired on ICE facility hated U.S. government, sought to kill federal agents, say officials",Hindu,https://www.thehindu.com/news/international/man-who-fired-on-ice-facility-hated-us-government-sought-to-kill-federal-agents-say-officials/article70096211.ece,International
198,"U.S. President Trump meets Pakistan PM Sharif, Field Marshal Munir at White House",Hindu,https://www.thehindu.com/news/international/trump-holds-talks-with-pakistans-prime-minister-shehbaz-sharif-updates/article70095339.ece,International
199,"Terrorism ‘persistent threat’ to development, says EAM Jaishankar in G20 Foreign Ministers’ meeting",Hindu,https://www.thehindu.com/news/national/terrorism-persistent-threat-to-development-eam-jaishankar/article70096194.ece,International
200,"Trump says U.S. will impose new tariffs on heavy trucks, drugs and kitchen cabinets",Hindu,https://www.thehindu.com/news/international/trump-says-us-will-impose-new-tariffs-on-heavy-trucks-drugs-and-kitchen-cabinets/article70096182.ece,International
