S.No,Headline,Source,Link,Category,Timestamp
388,Why we are losing young lives to heart disease and how we can tackle this,Hindu,https://www.thehindu.com/sci-tech/health/why-we-are-losing-young-lives-to-heart-disease-and-how-we-can-tackle-this/article70079474.ece,SciTech,"Mon, 29 Sep 2025 07:00:00 +0530"
389,Clustering maize plants together can improve their insect resistance,Hindu,https://www.thehindu.com/sci-tech/science/clustering-maize-plants-together-can-improve-their-insect-resistance/article70104803.ece,SciTech,"Mon, 29 Sep 2025 05:30:00 +0530"
390,"Government aims to integrate Ayurveda into health education curriculum in schools, colleges: Minister",Hindu,https://www.thehindu.com/sci-tech/health/government-aims-to-integrate-ayurveda-into-health-education-curriculum-in-schools-colleges-minister/article70105509.ece,SciTech,"Mon, 29 Sep 2025 03:38:40 +0530"
391,Going beyond the metaphor ‘young at heart’,Hindu,https://www.thehindu.com/opinion/op-ed/going-beyond-the-metaphor-young-at-heart/article70104647.ece,SciTech,"Mon, 29 Sep 2025 02:47:38 +0530"
392,Reimagining green economy through landscapes,Hindu,https://www.thehindu.com/opinion/op-ed/reimagining-green-economy-through-landscapes/article70106596.ece,SciTech,"Mon, 29 Sep 2025 02:13:05 +0530"
393,Why a study claiming vaccines cause chronic illness is severely flawed – a biostatistician explains the biases and unsupported conclusions,Hindu,https://www.thehindu.com/sci-tech/health/why-a-study-claiming-vaccines-cause-chronic-illness-is-severely-flawed-a-biostatistician-explains-the-biases-and-unsupported-conclusions/article70104653.ece,SciTech,"Sun, 28 Sep 2025 19:39:50 +0530"
394,First India-born cheetah set to reach adulthood in Kuno National Park,Hindu,https://www.thehindu.com/news/national/first-india-born-cheetah-set-to-reach-adulthood-in-kuno-national-park/article70105094.ece,SciTech,"Sun, 28 Sep 2025 17:04:24 +0530"
395,What your child’s platelet count and haemoglobin levels could be telling you,Hindu,https://www.thehindu.com/sci-tech/health/what-your-childs-platelet-count-and-haemoglobin-levels-could-be-telling-you/article70079378.ece,SciTech,"Sun, 28 Sep 2025 16:00:00 +0530"
396,What is multi-messenger astronomy?,Hindu,https://www.thehindu.com/sci-tech/science/what-is-multi-messenger-astronomy/article70104783.ece,SciTech,"Sun, 28 Sep 2025 13:30:45 +0530"
397,A decade among the stars: India’s first space observatory AstroSat completes 10 years,Hindu,https://www.thehindu.com/sci-tech/science/a-decade-among-the-stars-indias-first-space-observatory-astrosat-completes-10-years/article70104675.ece,SciTech,"Sun, 28 Sep 2025 12:53:08 +0530"
398,Govt report estimates one-third of India's children age 5-9 have high triglycerides,Hindu,https://www.thehindu.com/sci-tech/health/govt-report-estimates-one-third-of-indias-children-age-5-9-have-high-triglycerides/article70104618.ece,SciTech,"Sun, 28 Sep 2025 11:43:41 +0530"
399,Why eco-restoration alone won’t help residents of the heavily industrialised Manali-Ennore region in North Chennai,Hindu,https://www.thehindu.com/sci-tech/health/why-eco-restoration-alone-wont-help-residents-of-the-heavily-industrialised-manali-ennore-region-in-north-chennai/article70096350.ece,SciTech,"Sun, 28 Sep 2025 11:00:00 +0530"
400,"Raised in Assam’s temple pond, 104 turtle hatchlings released in rhino habitat",Hindu,https://www.thehindu.com/news/national/assam/raised-in-assams-temple-pond-104-turtle-hatchlings-released-in-rhino-habitat/article70104417.ece,SciTech,"Sun, 28 Sep 2025 10:36:18 +0530"
401,Watch: India’s renewables push is incomplete; here’s why: the storage challenge,Hindu,https://www.thehindu.com/videos/watch-indias-renewables-push-is-incomplete-heres-why-the-storage-challenge/article70104469.ece,SciTech,"Sun, 28 Sep 2025 09:31:35 +0530"
402,India's Cold Desert Biosphere Reserve designated by UNESCO,Hindu,https://www.thehindu.com/sci-tech/energy-and-environment/indias-cold-desert-biosphere-reserve-designated-by-unesco/article70103250.ece,SciTech,"Sun, 28 Sep 2025 07:36:56 +0530"
403,Has AI finally solved your email problem?,Hindu,https://www.thehindu.com/sci-tech/technology/has-ai-finally-solved-your-email-problem/article70088578.ece,SciTech,"Sun, 28 Sep 2025 06:00:00 +0530"
404,Can an ivermectin pill keep malaria from being transmitted?,Hindu,https://www.thehindu.com/sci-tech/science/can-an-ivermectin-pill-keep-malaria-from-being-transmitted/article70083972.ece,SciTech,"Sun, 28 Sep 2025 05:30:00 +0530"
405,"Elephants in fragmented habitats of South Bengal record higher levels of stress, reveals study",Hindu,https://www.thehindu.com/sci-tech/energy-and-environment/elephants-in-fragmented-habitats-of-south-bengal-record-higher-levels-of-stress-reveals-study/article70102388.ece,SciTech,"Sun, 28 Sep 2025 04:57:02 +0530"
406,How Israel used Azure to monitor Palestinians | Explained,Hindu,https://www.thehindu.com/news/international/how-israel-used-azure-to-monitor-palestinians-explained/article70103052.ece,SciTech,"Sun, 28 Sep 2025 02:19:42 +0530"
407,Diella | Virtual minister,Hindu,https://www.thehindu.com/sci-tech/technology/diella-virtual-minister/article70103098.ece,SciTech,"Sun, 28 Sep 2025 01:30:00 +0530"
408,Acetaminophen | Spectacle of blame,Hindu,https://www.thehindu.com/sci-tech/health/acetaminophen-spectacle-of-blame/article70103090.ece,SciTech,"Sun, 28 Sep 2025 01:15:00 +0530"
409,More than seven decades of science for peace,Hindu,https://www.thehindu.com/children/more-than-seven-decades-of-science-for-peace/article70056488.ece,SciTech,"Sun, 28 Sep 2025 00:41:00 +0530"
410,"Students, MLAs urge ICAR to include agri school students in B.Sc. Agriculture admissions",Hindu,https://www.thehindu.com/news/national/students-mlas-urge-icar-to-include-agri-school-students-in-bsc-agriculture-admissions/article70102549.ece,SciTech,"Sat, 27 Sep 2025 20:30:46 +0530"
411,Science quiz: On environmental health,Hindu,https://www.thehindu.com/sci-tech/health/science-quiz-on-environmental-health/article70087777.ece,SciTech,"Sat, 27 Sep 2025 19:46:26 +0530"
412,"Not just one-horned rhino, Kaziranga Park also harbours a rich variety of insects, spiders",Hindu,https://www.thehindu.com/sci-tech/energy-and-environment/kaziranga-records-283-species-of-native-insects-spiders/article70101258.ece,SciTech,"Sat, 27 Sep 2025 13:50:08 +0530"
413,Three Indian doctors awarded with Gates Foundation’s Goalkeepers Champions Award,Hindu,https://www.thehindu.com/news/national/maharashtra/three-indian-doctors-awarded-with-gates-foundations-goalkeepers-champions-award/article70090210.ece,SciTech,"Sat, 27 Sep 2025 13:21:48 +0530"
414,World Rhino Day 2025 | The story of the horn and hair,Hindu,https://www.thehindu.com/children/world-rhino-day-the-story-of-the-horn-and-hair/article69955514.ece,SciTech,"Sat, 27 Sep 2025 13:06:33 +0530"
415,"Bosch Unlimited 7 Review | Intuitive, thoughtfully designed and apt for Indian cleaning needs",Hindu,https://www.thehindu.com/sci-tech/technology/gadgets/bosch-unlimited-7-review-intuitive-thoughtfully-designed-and-apt-for-indian-cleaning-needs/article70101266.ece,SciTech,"Sat, 27 Sep 2025 13:05:15 +0530"
416,PM Modi inaugurates BSNL’s ‘swadeshi’ 4G network from Odisha,Hindu,https://www.thehindu.com/sci-tech/technology/pm-modi-inaugurates-bsnl-swadeshi-4g-network-from-odisha/article70101174.ece,SciTech,"Sat, 27 Sep 2025 12:20:32 +0530"
417,"Taiwan seeks bigger tech presence in India as U.S. demand rises, trade body chief says",Hindu,https://www.thehindu.com/sci-tech/technology/taiwan-seeks-bigger-tech-presence-in-india-as-us-demand-rises-trade-body-chief-says/article70100901.ece,SciTech,"Sat, 27 Sep 2025 10:29:35 +0530"
418,Amazon loses VP helping lead development of artificial general intelligence,Hindu,https://www.thehindu.com/sci-tech/technology/amazon-loses-vp-helping-lead-development-of-artificial-general-intelligence/article70100895.ece,SciTech,"Sat, 27 Sep 2025 10:21:36 +0530"
419,Anthropic to triple international workforce as AI models drive growth outside U.S.,Hindu,https://www.thehindu.com/sci-tech/technology/anthropic-to-triple-international-workforce-as-ai-models-drive-growth-outside-us/article70100896.ece,SciTech,"Sat, 27 Sep 2025 10:14:57 +0530"
420,Trump says Microsoft should fire its global affairs president Lisa Monaco,Hindu,https://www.thehindu.com/sci-tech/technology/trump-says-microsoft-should-fire-its-global-affairs-president-lisa-monaco/article70100897.ece,SciTech,"Sat, 27 Sep 2025 10:07:53 +0530"
421,Meta to launch ad-free Facebook and Instagram subscriptions in UK,Hindu,https://www.thehindu.com/sci-tech/technology/meta-to-launch-ad-free-facebook-and-instagram-subscriptions-in-uk/article70100899.ece,SciTech,"Sat, 27 Sep 2025 10:00:08 +0530"
422,ByteDance expected to maintain big role in new U.S. TikTok,Hindu,https://www.thehindu.com/sci-tech/technology/bytedance-expected-to-maintain-big-role-in-new-us-tiktok/article70100902.ece,SciTech,"Sat, 27 Sep 2025 09:54:26 +0530"
423,Could roses help heal diabetic wounds? A new research paper finds out,Hindu,https://www.thehindu.com/sci-tech/health/could-roses-help-heal-diabetic-wounds-a-new-research-paper-finds-out/article70083620.ece,SciTech,"Sat, 27 Sep 2025 08:30:00 +0530"
424,U.S. rejects WHO non-communicable diseases declaration: Robert F. Kennedy Jr.,Hindu,https://www.thehindu.com/news/international/us-rejects-who-non-communicable-diseases-declaration-robert-f-kennedy-jr/article70098253.ece,SciTech,"Sat, 27 Sep 2025 01:23:53 +0530"
425,NISAR satellite sends first radar images of Earth’s surface,Hindu,https://www.thehindu.com/sci-tech/science/nisar-satellite-sends-first-radar-images-of-earths-surface/article70099334.ece,SciTech,"Sat, 27 Sep 2025 00:02:50 +0530"
426,Science Ministry survey on R&D in India gets weak response from private sector,Hindu,https://www.thehindu.com/sci-tech/science/science-ministry-survey-on-research-and-development-in-india-gets-weak-response-from-private-sector/article70098344.ece,SciTech,"Fri, 26 Sep 2025 23:26:31 +0530"
427,"Recall Char Dham project judgment: Murli Manohar Joshi, environmentalists to Supreme Court",Hindu,https://www.thehindu.com/sci-tech/energy-and-environment/environmentalists-former-minister-appeal-supreme-court-to-restrain-himalayan-road-building/article70098968.ece,SciTech,"Fri, 26 Sep 2025 22:48:33 +0530"
428,"Astronauts with diabetes can undertake space missions, says study conducted during Axiom-4 mission",Hindu,https://www.thehindu.com/sci-tech/science/astronauts-with-diabetes-can-undertake-space-missions-says-study-conducted-during-axiom-4-mission/article70098664.ece,SciTech,"Fri, 26 Sep 2025 21:01:36 +0530"
429,"Oracle, Silver Lake part of group of investors who will own about 50% of TikTok U.S., source says",Hindu,https://www.thehindu.com/sci-tech/technology/oracle-silver-lake-part-of-group-of-investors-who-will-own-about-50-of-tiktok-us-source-says/article70098050.ece,SciTech,"Fri, 26 Sep 2025 19:07:43 +0530"
430,New method in Pichavaram uses tidal fluctuations to improve the survival of mangrove saplings,Hindu,https://www.thehindu.com/news/national/tamil-nadu/new-method-in-pichavaram-uses-tidal-fluctuations-to-improve-the-survival-of-mangrove-saplings/article70097405.ece,SciTech,"Fri, 26 Sep 2025 18:05:37 +0530"
431,"Watch: Post-COVID heart risks, men’s health, and what’s the new WHO update on essential meds?",Hindu,https://www.thehindu.com/videos/watch-post-covid-heart-risks-mens-health-and-whats-the-new-who-update-on-essential-meds/article70096935.ece,SciTech,"Fri, 26 Sep 2025 16:00:00 +0530"
432,Spotify to crack down on AI impersonation of musicians and spammy tracks,Hindu,https://www.thehindu.com/sci-tech/technology/spotify-to-crack-down-on-ai-impersonation-of-musicians-and-spammy-tracks/article70097069.ece,SciTech,"Fri, 26 Sep 2025 14:54:35 +0530"
433,Primebook 2 Neo Review | Bold concept pulled down by poor sound and trackpad,Hindu,https://www.thehindu.com/sci-tech/technology/gadgets/primebook-2-neo-review-bold-concept-pulled-down-by-poor-sound-and-trackpad/article70097110.ece,SciTech,"Fri, 26 Sep 2025 14:35:30 +0530"
434,The Science Quiz: Scientists and pseudoscience,Hindu,https://www.thehindu.com/sci-tech/science/the-science-quiz-scientists-and-pseudoscience/article70088701.ece,SciTech,"Fri, 26 Sep 2025 13:10:27 +0530"
435,OpenAI introduces ChatGPT Pulse for personalised daily reports,Hindu,https://www.thehindu.com/sci-tech/technology/openai-introduces-chatgpt-pulse-for-personalised-daily-reports/article70096917.ece,SciTech,"Fri, 26 Sep 2025 12:54:59 +0530"
436,"Sexually transmitted disease cases fall, but not syphilis in newborns",Hindu,https://www.thehindu.com/sci-tech/health/sexually-transmitted-disease-cases-fall-but-not-syphilis-in-newborns/article70096886.ece,SciTech,"Fri, 26 Sep 2025 12:46:17 +0530"
437,"Healthcare reforms required globally to match progress in diagnosis, treatment of Alzheimer's disease: researchers",Hindu,https://www.thehindu.com/sci-tech/health/healthcare-reforms-required-globally-to-match-progress-in-diagnosis-treatment-of-alzheimers-disease-researchers/article70096833.ece,SciTech,"Fri, 26 Sep 2025 12:32:40 +0530"
438,"1,000 kidney transplants and counting at Chennai’s Stanley Hospital",Hindu,https://www.thehindu.com/news/cities/chennai/1000-kidney-transplants-and-counting-at-chennais-stanley-hospital/article70074612.ece,SciTech,"Fri, 26 Sep 2025 12:30:17 +0530"
439,Halal concerns drive vaccine hesitancy as Indonesia fights measles outbreak,Hindu,https://www.thehindu.com/news/international/halal-concerns-drive-vaccine-hesitancy-as-indonesia-fights-measles-outbreak/article70096789.ece,SciTech,"Fri, 26 Sep 2025 12:20:17 +0530"
440,U.S. plans 1:1 chip production rule to curb overseas reliance: Report,Hindu,https://www.thehindu.com/sci-tech/technology/us-plans-11-chip-production-rule-to-curb-overseas-reliance-report/article70096705.ece,SciTech,"Fri, 26 Sep 2025 12:11:09 +0530"
441,"CoreWeave expands OpenAI pact with new $6.5 billion contract, sees ""the quarter of diversification""",Hindu,https://www.thehindu.com/sci-tech/technology/coreweave-expands-openai-pact-with-new-65-billion-contract-sees-the-quarter-of-diversification/article70096276.ece,SciTech,"Fri, 26 Sep 2025 11:20:48 +0530"
442,Cisco rolls out software aimed at connecting a quantum computing cloud,Hindu,https://www.thehindu.com/sci-tech/technology/cisco-rolls-out-software-aimed-at-connecting-a-quantum-computing-cloud/article70096263.ece,SciTech,"Fri, 26 Sep 2025 11:15:01 +0530"
443,Google likely to be hit with first EU antitrust fine under new EU law,Hindu,https://www.thehindu.com/sci-tech/technology/google-likely-to-be-hit-with-first-eu-antitrust-fine-under-new-eu-law/article70096365.ece,SciTech,"Fri, 26 Sep 2025 10:47:12 +0530"
444,"Instagram’s teen safety features are flawed, researchers say",Hindu,https://www.thehindu.com/sci-tech/technology/instagrams-teen-safety-features-are-flawed-researchers-say/article70096274.ece,SciTech,"Fri, 26 Sep 2025 10:31:10 +0530"
445,Musk's xAI accuses rival OpenAI of stealing trade secrets,Hindu,https://www.thehindu.com/sci-tech/technology/musks-xai-accuses-rival-openai-of-stealing-trade-secrets/article70096459.ece,SciTech,"Fri, 26 Sep 2025 10:21:18 +0530"
446,Elon Musk's xAI to provide Grok chatbot to U.S. federal agencies,Hindu,https://www.thehindu.com/sci-tech/technology/elon-musks-xai-to-provide-grok-chatbot-to-us-federal-agencies/article70096281.ece,SciTech,"Fri, 26 Sep 2025 10:17:07 +0530"
447,Meta unveils new AI video feed Vibes,Hindu,https://www.thehindu.com/sci-tech/technology/meta-unveils-new-ai-video-feed-vibes/article70096362.ece,SciTech,"Fri, 26 Sep 2025 10:14:50 +0530"
448,Intel approaches TSMC for investments or partnership: Report,Hindu,https://www.thehindu.com/sci-tech/technology/intel-approaches-tsmc-for-investments-or-partnership-report/article70096363.ece,SciTech,"Fri, 26 Sep 2025 10:10:08 +0530"
449,Amazon's AWS CEO chides staff for slow product rollouts,Hindu,https://www.thehindu.com/sci-tech/technology/amazons-aws-ceo-chides-staff-for-slow-product-rollouts/article70096364.ece,SciTech,"Fri, 26 Sep 2025 10:05:16 +0530"
450,"Databricks, OpenAI team up to deliver AI models for enterprise clients",Hindu,https://www.thehindu.com/sci-tech/technology/databricks-openai-team-up-to-deliver-ai-models-for-enterprise-clients/article70096368.ece,SciTech,"Fri, 26 Sep 2025 09:54:37 +0530"
451,Meta in talks to use Google's Gemini to improve ad business: Report,Hindu,https://www.thehindu.com/sci-tech/technology/meta-in-talks-to-use-googles-gemini-to-improve-ad-business-report/article70096284.ece,SciTech,"Fri, 26 Sep 2025 09:52:21 +0530"
452,U.S. judge preliminarily approves $1.5 billion Anthropic copyright settlement,Hindu,https://www.thehindu.com/sci-tech/technology/us-judge-preliminarily-approves-15-billion-anthropic-copyright-settlement/article70096260.ece,SciTech,"Fri, 26 Sep 2025 09:41:01 +0530"
453,U.S. sounds alarm over hackers targeting Cisco security devices,Hindu,https://www.thehindu.com/sci-tech/technology/us-sounds-alarm-over-hackers-targeting-cisco-security-devices/article70096283.ece,SciTech,"Fri, 26 Sep 2025 09:08:47 +0530"
454,Amazon to pay $2.5 billion to settle Prime deception allegations,Hindu,https://www.thehindu.com/sci-tech/technology/amazon-to-pay-25-billion-to-settle-prime-deception-allegations/article70096270.ece,SciTech,"Fri, 26 Sep 2025 08:53:21 +0530"
455,The right to be cool in a sweltering Global South,Hindu,https://www.thehindu.com/sci-tech/energy-and-environment/the-right-to-be-cool-in-a-sweltering-south/article70093081.ece,SciTech,"Fri, 26 Sep 2025 08:30:00 +0530"
456,Muscle matters: rethinking obesity with resistance training,Hindu,https://www.thehindu.com/sci-tech/health/muscle-matters-rethinking-obesity-with-resistance-training/article70051463.ece,SciTech,"Fri, 26 Sep 2025 06:00:00 +0530"
457,Why does sadness cause us to shed tears?,Hindu,https://www.thehindu.com/sci-tech/science/why-does-sadness-cause-us-to-shed-tears/article70084015.ece,SciTech,"Fri, 26 Sep 2025 06:00:00 +0530"
458,Not ‘only’ a nail infection,Hindu,https://www.thehindu.com/sci-tech/health/not-only-a-nail-infection/article70065100.ece,SciTech,"Fri, 26 Sep 2025 06:00:00 +0530"
459,Trump signs order declaring TikTok sale plan meets U.S. requirements,Hindu,https://www.thehindu.com/news/international/trump-signs-order-declaring-tiktok-sale-plan-meets-us-requirements/article70095159.ece,SciTech,"Fri, 26 Sep 2025 02:08:51 +0530"
460,HPV vaccine to be available on Vidal Health’s digital platform,Hindu,https://www.thehindu.com/sci-tech/health/hpv-vaccine-to-be-available-on-vidal-healths-digital-platform/article70094387.ece,SciTech,"Fri, 26 Sep 2025 01:40:00 +0530"
461,Microsoft disables services to Israel defence unit after review,Hindu,https://www.thehindu.com/sci-tech/technology/microsoft-disables-services-to-israel-defence-unit-after-review/article70094906.ece,SciTech,"Thu, 25 Sep 2025 23:01:13 +0530"
462,Study projects cancer deaths to rise by 75% in next 25 years; ageing among driving factors,Hindu,https://www.thehindu.com/sci-tech/health/study-projects-cancer-deaths-to-rise-by-75-in-next-25-years-ageing-among-driving-factors/article70093440.ece,SciTech,"Thu, 25 Sep 2025 19:25:22 +0530"
463,World lung day : understanding common respiratory diseases and their effective management,Hindu,https://www.thehindu.com/sci-tech/health/world-lung-day-understanding-common-respiratory-diseases-and-their-effective-management/article70092903.ece,SciTech,"Thu, 25 Sep 2025 19:13:36 +0530"
464,"Amazon receives 38 crore customer visits in 2 days, smartphones register double digit growth",Hindu,https://www.thehindu.com/sci-tech/technology/amazon-receives-38-crore-customer-visits-in-2-days-smartphones-register-double-digit-growth/article70093476.ece,SciTech,"Thu, 25 Sep 2025 18:25:11 +0530"
465,"Salt, Gandhi, and the physiology of sodium hunger",Hindu,https://www.thehindu.com/sci-tech/health/salt-gandhi-and-the-physiology-of-sodium-hunger/article70069082.ece,SciTech,"Thu, 25 Sep 2025 18:24:34 +0530"
466,Telangana’s T-Works spearheads flight simulator development,Hindu,https://www.thehindu.com/news/national/telangana/telanganas-t-works-spearheads-flight-simulator-development/article70093053.ece,SciTech,"Thu, 25 Sep 2025 17:08:28 +0530"
467,Western Ghats and wildlife roadkill | Green Humour by Rohan Chakravarty,Hindu,https://www.thehindu.com/sci-tech/energy-and-environment/western-ghats-and-wildlife-roadkill-green-humour-by-rohan-chakravarty/article70079782.ece,SciTech,"Thu, 25 Sep 2025 17:01:07 +0530"
468,All you need to know about: otroverts,Hindu,https://www.thehindu.com/sci-tech/health/all-you-need-to-know-about-otroverts/article70083490.ece,SciTech,"Thu, 25 Sep 2025 15:30:00 +0530"
469,India’s first dugong reserve in Palk Bay gains global recognition at IUCN Congress,Hindu,https://www.thehindu.com/sci-tech/energy-and-environment/indias-first-dugong-reserve-in-palk-bay-gains-global-recognition-at-iucn-congress/article70092524.ece,SciTech,"Thu, 25 Sep 2025 15:20:58 +0530"
470,AI “companions” use emotional manipulation to keep you chatting longer: Study,Hindu,https://www.thehindu.com/sci-tech/technology/ai-companions-use-emotional-manipulation-to-keep-you-chatting-longer-study/article70092622.ece,SciTech,"Thu, 25 Sep 2025 14:41:01 +0530"
471,Singapore threatens fines for Meta over Facebook impersonation scams,Hindu,https://www.thehindu.com/sci-tech/technology/singapore-threatens-fines-for-meta-over-facebook-impersonation-scams/article70092549.ece,SciTech,"Thu, 25 Sep 2025 14:00:39 +0530"
472,"Apple blames EU tech law for postponed features, app marketplace risks",Hindu,https://www.thehindu.com/sci-tech/technology/apple-blames-eu-tech-law-for-postponed-features-app-marketplace-risks/article70092491.ece,SciTech,"Thu, 25 Sep 2025 13:35:46 +0530"
473,Qualcomm launches Snapdragon 8 Elite Gen 5 along with Snapdragon X2 Elite processors,Hindu,https://www.thehindu.com/sci-tech/technology/gadgets/qualcomm-launches-snapdragon-8-elite-gen-5-along-with-snapdragon-x2-elite-processors/article70092498.ece,SciTech,"Thu, 25 Sep 2025 13:22:33 +0530"
474,Google unveils AI mood board tool Mixboard,Hindu,https://www.thehindu.com/sci-tech/technology/google-unveils-ai-mood-board-tool-mixboard/article70092436.ece,SciTech,"Thu, 25 Sep 2025 12:58:13 +0530"
475,"Nothing’s CMF to operate as independent subsidiary in India, announces JV with Optiemus",Hindu,https://www.thehindu.com/sci-tech/technology/nothings-cmf-to-operate-as-independent-subsidiary-in-india-announces-jv-with-optiemus/article70092182.ece,SciTech,"Thu, 25 Sep 2025 11:57:06 +0530"
476,OpenAI is building ads team internally: Report,Hindu,https://www.thehindu.com/sci-tech/technology/openai-is-building-ads-team-internally-report/article70092192.ece,SciTech,"Thu, 25 Sep 2025 11:55:09 +0530"
477,"China, world's largest carbon polluting nation, announces new climate goal to cut emissions",Hindu,https://www.thehindu.com/news/international/china-worlds-largest-carbon-polluting-nation-announces-new-climate-goal-to-cut-emissions/article70092039.ece,SciTech,"Thu, 25 Sep 2025 11:31:23 +0530"
478,"Trump will sign TikTok executive order on Thursday, source says",Hindu,https://www.thehindu.com/sci-tech/technology/trump-will-sign-tiktok-executive-order-on-thursday-source-says/article70091771.ece,SciTech,"Thu, 25 Sep 2025 11:00:39 +0530"
479,"OpenAI, under pressure to meet demand, widens scope of Stargate and eyes debt to finance chips",Hindu,https://www.thehindu.com/sci-tech/technology/openai-under-pressure-to-meet-demand-widens-scope-of-stargate-and-eyes-debt-to-finance-chips/article70091869.ece,SciTech,"Thu, 25 Sep 2025 10:39:19 +0530"
480,"TSMC, chip design software firms tap AI to help chips use less energy",Hindu,https://www.thehindu.com/sci-tech/technology/tsmc-chip-design-software-firms-tap-ai-to-help-chips-use-less-energy/article70091783.ece,SciTech,"Thu, 25 Sep 2025 10:09:27 +0530"
481,India beat Pakistan in thriller to win Asia Cup,BBC,https://www.bbc.com/sport/cricket/articles/c2ej42lmx3mo?at_medium=RSS&at_campaign=rss,India,2025-09-28 20:56:31
482,At least 40 dead in crush at political rally in India,BBC,https://www.bbc.com/news/articles/c98dqyj5dpjo?at_medium=RSS&at_campaign=rss,India,2025-09-28 14:45:15
483,Justice on hold: India court crippled by a million-case backlog,BBC,https://www.bbc.com/news/articles/c4gz4y4p80po?at_medium=RSS&at_campaign=rss,India,2025-09-28 23:57:57
484,How smelly shoes inspired India's Ig Nobel prize-winning study,BBC,https://www.bbc.com/news/articles/cpq51xp4e91o?at_medium=RSS&at_campaign=rss,India,2025-09-28 00:25:28
485,H-1B visa changes may give Canada an opportunity. Will it seize it?,BBC,https://www.bbc.com/news/articles/cx27lj39e99o?at_medium=RSS&at_campaign=rss,India,2025-09-27 21:14:34
486,How India's war against Maoists is affecting its people,BBC,https://www.bbc.com/news/articles/c9qj9w5qyngo?at_medium=RSS&at_campaign=rss,India,2025-09-27 01:51:30
487,"Woman, 73, deported by ICE to India after three decades in US",BBC,https://www.bbc.com/news/articles/c0jqvz24llyo?at_medium=RSS&at_campaign=rss,India,2025-09-26 19:05:03
488,The Indian who caught 'Bikini killer' twice - and is now Netflix hero,BBC,https://www.bbc.com/news/articles/cq65gvjqz88o?at_medium=RSS&at_campaign=rss,India,2025-09-26 00:08:11
489,The sun sets on India's iconic and controversial Soviet fighter jet,BBC,https://www.bbc.com/news/articles/cly72e3zrjno?at_medium=RSS&at_campaign=rss,India,2025-09-24 22:42:00
490,Bollywood stars fight for personality rights amid deepfake surge,BBC,https://www.bbc.com/news/articles/cz08y4ppvr5o?at_medium=RSS&at_campaign=rss,India,2025-09-23 22:51:08
491,Why the Pakistan-Saudi Arabia defence pact is unsettling India,BBC,https://www.bbc.com/news/articles/c147gkxyyrmo?at_medium=RSS&at_campaign=rss,India,2025-09-22 22:29:35
